tipo,nome,matricula,simbolo,cargo_comissao,lotacao,orgao,vigencia,pedido,cargo_efetivo,siape,motivo,texto
Exoneração, ARNALDO JOAQUIM DE SANTANA,nan,nan, MEDICO,nan,nan,nan,a pedido,nan,nan,nan,"EXONERAR, a pedido, ARNALDO JOAQUIM DE SANTANA, da Carreira de MEDICO, cargo
de MEDICO - GINECO"
Exoneração, LETICIA MAGALHAES COSTA CAFE,nan,nan, MEDICO,nan,nan,nan,a pedido,nan,nan,nan,"EXONERAR, a pedido, LETICIA MAGALHAES COSTA CAFE, da Carreira de MEDICO, cargo
de MEDICO - TER"
Exoneração, MARCELO ROLANDO ALVES,nan,nan, MEDICO,nan,nan,nan,a pedido,nan,nan,nan,"EXONERAR, a pedido, MARCELO ROLANDO ALVES, da Carreira de MEDICO, cargo de
MEDICO - ANESTESIOLOGIA, 2a Classe, Padrao II, Matricula 14374234, do Quadro de Pessoal do
Distrito Federal com lotacao na Secretaria de Estado de Saude do Distrito Federal, com base nos termos
do caput do Artigo 51, da Lei Complementar no"
