tipo,nome,matricula,simbolo,cargo_comissao,lotacao,orgao,vigencia,pedido,cargo_efetivo,siape,motivo,texto
Exoneração, LUCIANA STEFANE DE ALMEIDA DIONISIO,nan,nan,nan,nan,nan,nan,nan,nan,nan,nan,EXONERAR LUCIANA STEFANE DE ALMEIDA DIONISIO
Exoneração," 
LUCIANA STEFANE DE ALMEIDA DIONISIO",nan,nan,nan,nan,nan,nan,a pedido,nan,nan,nan,"EXONERAR, a pedido, 
LUCIANA STEFANE DE ALMEIDA DIONISIO"
Exoneração, BRUNO RAFAEL DE AGUIAR,nan,nan,nan,nan,nan,nan,a pedido,nan,nan,nan,"EXONERAR, a pedido, BRUNO RAFAEL DE AGUIAR, matricula 182"
