text,id,label,annotator,annotation_id,created_at,updated_at,lead_time
"AVISO DE ANULACAO PREGAO ELETRONICO (SRP) 10/2019
(EXCLUSIVO PARA ENTIDADES PREFERENCIAIS)
A SECRETARIA DE ESTADO DA AGRICULTURA, ABASTECIMENTO E DESENVOLVIMENTO
RURAL DO DISTRITO FEDERAL, torna publico que fica anulada a licitacao supracitada, referente ao
Processo no 00070-00004102/2019-61. Objeto: Contratacao de servico de investigacao geotecnica para
execucao de sondagem a percussao. Serao aproximadamente 30 (trinta) furos de sondagem a percussao,
distribuidos em diversos terrenos de propriedade do Governo do Distrito Federal, visando subsidiar a
elaboracao de projetos de fundacoes para edificacoes voltadas para a area rural e/ou para a manutencao dos
proprios da SEAGRI, sobretudo nas Regioes Administrativas de Brazlandia, Lago Norte, Paranoa,
Planaltina, Plano Piloto (Asa Norte) e Sao Sebastiao, para fins de correcao da forma de apresentacao dos
precos em termo de referencia, para que seja possivel aos licitantes incluir nos precos ofertados todos os
custos necessarios a execucao do servicos.
EDILENE DIAS CERQUEIRA
Pregoeira",42254,"[{""start"": 18, ""end"": 35, ""text"": ""PREGAO ELETRONICO"", ""labels"": [""modalidade_licitacao""]}, {""start"": 42, ""end"": 49, ""text"": ""10/2019"", ""labels"": [""numero_licitacao""]}, {""start"": 93, ""end"": 187, ""text"": ""SECRETARIA DE ESTADO DA AGRICULTURA, ABASTECIMENTO E DESENVOLVIMENTO\nRURAL DO DISTRITO FEDERAL"", ""labels"": [""orgao_licitante""]}, {""start"": 212, ""end"": 219, ""text"": ""anulada"", ""labels"": [""identificacao_ocorrencia""]}, {""start"": 270, ""end"": 292, ""text"": ""00070-00004102/2019-61"", ""labels"": [""processo_gdf""]}, {""start"": 1013, ""end"": 1035, ""text"": ""EDILENE DIAS CERQUEIRA"", ""labels"": [""nome_responsavel""]}]",3,28046,2022-09-30T18:12:06.419055Z,2022-09-30T18:12:06.419068Z,
"AVISO DE ANULACAO
PREGAO ELETRONICO No 16/2017 - SRP
Processo no 054.002.382/2017. O Chefe do Departamento de Saude e Assistencia ao Pessoal
da Policia Militar do Distrito Federal torna publico aos interessados a ANULACAO do
certame em epigrafe, inicialmente previsto para ocorrer em 23/1/2018, as 14h, por vicio de
incompetencia na autorizacao do processo licitatorio. Objeto: Registro de Preco para aqui-
sicao de material farmacologico e hospitalar, conforme especificacoes e quantidades cons-
tantes no Anexo I do edital. Valor estimado de R$ 11.187,75 (onze mil cento e oitenta e sete
reais de setenta e cinco centavos). Informacoes: (61) 3190-8054 e dsap.sspre-
goes@pm.df.gov.br e dsap.sspregoes@gmail.com.
Brasilia/DF, 08 de fevereiro de 2018.
ROGERIO BRITO DE MIRANDA",42253,"[{""start"": 18, ""end"": 35, ""text"": ""PREGAO ELETRONICO"", ""labels"": [""modalidade_licitacao""]}, {""start"": 39, ""end"": 52, ""text"": ""16/2017 - SRP"", ""labels"": [""numero_licitacao""]}, {""start"": 65, ""end"": 81, ""text"": ""054.002.382/2017"", ""labels"": [""processo_gdf""]}, {""start"": 144, ""end"": 179, ""text"": ""Policia Militar do Distrito Federal"", ""labels"": [""orgao_licitante""]}, {""start"": 213, ""end"": 221, ""text"": ""ANULACAO"", ""labels"": [""identificacao_ocorrencia""]}, {""start"": 752, ""end"": 776, ""text"": ""ROGERIO BRITO DE MIRANDA"", ""labels"": [""nome_responsavel""]}]",3,28045,2022-09-30T18:12:06.418976Z,2022-09-30T18:12:06.418989Z,
"AVISO DE ANULACAO
PREGAO ELETRONICO SRP No 03/2017
O PREGOEIRO DA SECRETARIA DE ESTADO DE EDUCACAO DO DISTRITO FE-
DERAL, em atendimento a Decisao no 3816/2018 do Tribunal de Contas do Distrito Federal,
comunica a ANULACAO do PREGAO ELETRONICO - SRP no 03/2017, Contratacao de
empresa especializada em transporte de pessoas para prestacao de servico de transporte
escolar dos alunos da Rede Publica de Ensino do Distrito Federal na Regiao: ""C"" - Sao
Sebastiao, por meio de veiculos com motorista, monitor e encarregado conforme espe-
cificacao constante deste Termo Referencia e seu ENCARTE B, nos itinerarios residencia-
escola e vice-versa, bem como nas atividades curriculares ou extracurriculares contidas nos
Projetos Politicos Pedagogicos das Instituicoes Educacionais conforme especificacoes e con-
dicoes estabelecidas no termo de referencia constante do Anexo I do Edital, objeto do
procedimento administrativo no 080.000401/2016. Os autos ficam com vistas franqueadas aos
interessados, nesta Secretaria de Estado de Educacao, na SGAN 607 Projecoes ""D"" sala 309
(telefone 3901-2319), nos sites http://www.comprasnet.gov.br e http://w w w. s e . d f . g o v. b r.
JOSEMAR SALVIANO DA SILVA.",42252,"[{""start"": 43, ""end"": 50, ""text"": ""03/2017"", ""labels"": [""numero_licitacao""]}, {""start"": 18, ""end"": 35, ""text"": ""PREGAO ELETRONICO"", ""labels"": [""modalidade_licitacao""]}, {""start"": 66, ""end"": 120, ""text"": ""SECRETARIA DE ESTADO DE EDUCACAO DO DISTRITO FE-\nDERAL"", ""labels"": [""orgao_licitante""]}, {""start"": 214, ""end"": 222, ""text"": ""ANULACAO"", ""labels"": [""identificacao_ocorrencia""]}, {""start"": 923, ""end"": 938, ""text"": ""080.000401/2016"", ""labels"": [""processo_gdf""]}, {""start"": 1172, ""end"": 1197, ""text"": ""JOSEMAR SALVIANO DA SILVA"", ""labels"": [""nome_responsavel""]}]",3,28044,2022-09-30T18:12:06.418898Z,2022-09-30T18:12:06.418911Z,
"AVISO DE REVOGACAO DE LICITACAO
A Caesb torna publico que o Pregao Eletronico PE No 221/2019, processo no 092.000207/2019, realizado
no site: www.comprasnet.gov.br (UASG: 974200), tipo de licitacao: menor preco, para o registro de precos
para aquisicao de parafusos, arruelas, porcas e chumbadores, foi revogada por tratar-se de licitacao
fracassada.
NARA MAGALHAES DA SILVA
Pregoeira",42251,"[{""start"": 34, ""end"": 39, ""text"": ""Caesb"", ""labels"": [""orgao_licitante""]}, {""start"": 60, ""end"": 77, ""text"": ""Pregao Eletronico"", ""labels"": [""modalidade_licitacao""]}, {""start"": 84, ""end"": 92, ""text"": ""221/2019"", ""labels"": [""numero_licitacao""]}, {""start"": 106, ""end"": 121, ""text"": ""092.000207/2019"", ""labels"": [""processo_gdf""]}, {""start"": 303, ""end"": 311, ""text"": ""revogada"", ""labels"": [""identificacao_ocorrencia""]}, {""start"": 351, ""end"": 374, ""text"": ""NARA MAGALHAES DA SILVA"", ""labels"": [""nome_responsavel""]}]",3,28043,2022-09-30T18:12:06.418820Z,2022-09-30T18:12:06.418833Z,
"AVISO DE REVOGACAO DE LICITACAO
PREGAO ELETRONICO No 17/2019
A Camara Legislativa do Distrito Federal informa a revogacao do certame em epigrafe, conforme decisao
proferida no processo no 001-000631/2019, cujo objeto e o Registro de Preco para eventual contratacao de
empresa especializada em locacao, montagem e desmontagem de gradil de contencao e placas de
fechamento para a Camara Legislativa do Distrito Federal. Mais informacoes: (61) 3348-8650 e
cpl@cl.df.gov.br. Brasilia/DF, 15/07/2019. Daniel Luchine Ishihara - Pregoeiro.",42250,"[{""start"": 53, ""end"": 60, ""text"": ""17/2019"", ""labels"": [""numero_licitacao""]}, {""start"": 63, ""end"": 101, ""text"": ""Camara Legislativa do Distrito Federal"", ""labels"": [""orgao_licitante""]}, {""start"": 188, ""end"": 203, ""text"": ""001-000631/2019"", ""labels"": [""processo_gdf""]}, {""start"": 112, ""end"": 121, ""text"": ""revogacao"", ""labels"": [""identificacao_ocorrencia""]}, {""start"": 496, ""end"": 519, ""text"": ""Daniel Luchine Ishihara"", ""labels"": [""nome_responsavel""]}, {""start"": 32, ""end"": 49, ""text"": ""PREGAO ELETRONICO"", ""labels"": [""modalidade_licitacao""]}]",3,28042,2022-09-30T18:12:06.418740Z,2022-09-30T18:12:06.418753Z,
"AVISO DE REVOGACAO
PREGAO ELETRONICO No 35/2019
Objeto: aquisicao de material de consumo - CBUQ - concreto betuminoso usinado a quente - faixa c,
conforme especificacoes e condicoes no anexo I do edital, Processo SEI no 0011 3 . 0 0 0 1 3 8 8 2 / 2 0 1 9 - 2 3 .
Revogada a licitacao acima, conforme fundamentacao nos autos do processo.
Brasilia/DF, 15 de julho de 2019.
CELIA MARIA SIQUEIRA LEAL
Diretora",42249,"[{""start"": 40, ""end"": 47, ""text"": ""35/2019"", ""labels"": [""numero_licitacao""]}, {""start"": 19, ""end"": 36, ""text"": ""PREGAO ELETRONICO"", ""labels"": [""modalidade_licitacao""]}, {""start"": 263, ""end"": 271, ""text"": ""Revogada"", ""labels"": [""identificacao_ocorrencia""]}, {""start"": 220, ""end"": 260, ""text"": ""0011 3 . 0 0 0 1 3 8 8 2 / 2 0 1 9 - 2 3"", ""labels"": [""processo_gdf""]}, {""start"": 371, ""end"": 396, ""text"": ""CELIA MARIA SIQUEIRA LEAL"", ""labels"": [""nome_responsavel""]}]",3,28041,2022-09-30T18:12:06.418661Z,2022-09-30T18:12:06.418674Z,
"AVISO DE REVOGACAO
Comunicamos aos interessados na Concorrencia no 010/2017 - ASCAL/PRES - do tipo menor preco
unitario - para execucao de drenagem pluvial e pavimentacao asfaltica, intertravada e execucao de meio-
fio no Setor de Habitacoes Coletivas Noroeste - Parque Burle Marx, em Brasilia - DF, que a mesma fica
revogada por conveniencia administrativa, conforme fundamentado nos autos do processo no
112.000.935/2017. Data da ultima publicacao no DODF no 75, de 19 de abril de 2017, pagina 37. Para
maiores informacoes ligar para o telefone (0xx61) 3403-2321 ou (0xx61) 3403-2322.
Brasilia/DF, 15 de julho de 2019.
DELCIMAR PIRES MARTINS
Chefe da ASCAL/PRES",42248,"[{""start"": 51, ""end"": 63, ""text"": ""Concorrencia"", ""labels"": [""modalidade_licitacao""]}, {""start"": 67, ""end"": 88, ""text"": ""010/2017 - ASCAL/PRES"", ""labels"": [""numero_licitacao""]}, {""start"": 317, ""end"": 325, ""text"": ""revogada"", ""labels"": [""identificacao_ocorrencia""]}, {""start"": 406, ""end"": 422, ""text"": ""112.000.935/2017"", ""labels"": [""processo_gdf""]}, {""start"": 468, ""end"": 487, ""text"": ""19 de abril de 2017"", ""labels"": [""data_escrito""]}, {""start"": 621, ""end"": 643, ""text"": ""DELCIMAR PIRES MARTINS"", ""labels"": [""nome_responsavel""]}]",3,28040,2022-09-30T18:12:06.418584Z,2022-09-30T18:12:06.418598Z,
"AVISO DE REVOGACAO LICITACAO PUBLICA NACIONAL - LPN 011/2019
A Caesb, no ambito de seu Programa de Saneamento Ambiental, financiado pelo Banco Interamericano de
Desenvolvimento - BID, torna publico que a Licitacao Publica Nacional - LPN 011/2019, processo no
092.005465/2019, para execucao das Obras de Setorizacao e Adequacao de Redes nas localidades da Asa
Sul, Cruzeiro, Asa Norte e Jardim Botanico, incluindo o fornecimento e Instalacao do Novo Booster, foi
revogada por conveniencia administrativa.
GILMAR PERES MONTEIRO
Presidente da Comissao",42247,"[{""start"": 19, ""end"": 45, ""text"": ""LICITACAO PUBLICA NACIONAL"", ""labels"": [""modalidade_licitacao""]}, {""start"": 52, ""end"": 60, ""text"": ""011/2019"", ""labels"": [""numero_licitacao""]}, {""start"": 237, ""end"": 245, ""text"": ""011/2019"", ""labels"": [""numero_licitacao""]}, {""start"": 63, ""end"": 68, ""text"": ""Caesb"", ""labels"": [""orgao_licitante""]}, {""start"": 259, ""end"": 274, ""text"": ""092.005465/2019"", ""labels"": [""processo_gdf""]}, {""start"": 462, ""end"": 470, ""text"": ""revogada"", ""labels"": [""identificacao_ocorrencia""]}, {""start"": 504, ""end"": 525, ""text"": ""GILMAR PERES MONTEIRO"", ""labels"": [""nome_responsavel""]}]",3,28039,2022-09-30T18:12:06.418506Z,2022-09-30T18:12:06.418519Z,
"AVISO DE ANULACAO
PREGAO ELETRONICO No 10/2019
PROCESSO: 00053-00009769/2019-41/CBMDF. TIPO: Menor preco. OBJETO: Aquisicao de
microscopio reto trinocular para realizacao das analises laboratoriais para o CBMDF. O DICOA
informa a ANULACAO do certame, em razao da existencia de vicios insanaveis no certame. Esta
aberto o prazo recursal na forma do Art. 109, I, ""c"", da Lei 8.666/1993. Inf.: (61) 3901-3481. Marcelo
Teixeira Dantas.",42246,"[{""start"": 39, ""end"": 46, ""text"": ""10/2019"", ""labels"": [""numero_licitacao""]}, {""start"": 57, ""end"": 79, ""text"": ""00053-00009769/2019-41"", ""labels"": [""processo_gdf""]}, {""start"": 230, ""end"": 238, ""text"": ""ANULACAO"", ""labels"": [""identificacao_ocorrencia""]}, {""start"": 407, ""end"": 430, ""text"": ""Marcelo\nTeixeira Dantas"", ""labels"": [""nome_responsavel""]}, {""start"": 205, ""end"": 210, ""text"": ""CBMDF"", ""labels"": [""orgao_licitante""]}, {""start"": 18, ""end"": 35, ""text"": ""PREGAO ELETRONICO"", ""labels"": [""modalidade_licitacao""]}]",3,28038,2022-09-30T18:12:06.418424Z,2022-09-30T18:12:06.418437Z,
"AVISO DE REVOGACAO
PREGAO ELETRONICO No 123/2019 - UASG 926119
A Pregoeira da Central de Compras torna publico aos interessados que, o procedimento licitatorio para
contratacao de empresa especializada para a Operacao Logistica da cadeia de suprimentos, conforme
especificacoes e quantitativos constantes no Anexo I do Edital, restou REVOGADO, nos termos do
Processo no 00060-00123066/2018-91 e Art. 49 da Lei 8.666/93, por decisao prolatada pelo Subsecretario
de Administracao Geral, Antony Araujo Couto, e pelo Secretario de Estado de Saude, Osnei Okumoto,
para atender as necessidades e demandas exigidas para o sistema de operacao logistica desta Pasta, bem
como para conclusao de mapeamento da Cadeia de Suprimentos.
MERITA SIMIONE BORGES",42245,"[{""start"": 40, ""end"": 62, ""text"": ""123/2019 - UASG 926119"", ""labels"": [""numero_licitacao""]}, {""start"": 19, ""end"": 36, ""text"": ""PREGAO ELETRONICO"", ""labels"": [""modalidade_licitacao""]}, {""start"": 334, ""end"": 342, ""text"": ""REVOGADO"", ""labels"": [""identificacao_ocorrencia""]}, {""start"": 370, ""end"": 392, ""text"": ""00060-00123066/2018-91"", ""labels"": [""processo_gdf""]}, {""start"": 722, ""end"": 743, ""text"": ""MERITA SIMIONE BORGES"", ""labels"": [""nome_responsavel""]}]",3,28037,2022-09-30T18:12:06.418345Z,2022-09-30T18:12:06.418358Z,
"AVISO DE REVOGACAO
PREGAO ELETRONICO No 14/2019
PROCESSO: 0052.002.099/2016. OBJETO: Contratacao de servicos de solucao de impressao, copia e
digitalizacao a fim de atender necessidades gerais e especificas das unidades policiais da PCDF. TIPO:
Menor Preco. O ordenador de despesas da PCDF, de acordo com o artigo 109  1o da lei de
licitacoes, torna publico aos licitantes e demais interessados que o certame supracitado foi revogado,
devido a ocorrencia de falhas operacionais no Sistema COMPRASNET durante o tempo aleatorio para
lances, com possibilidade de cerceamento da competitividade entre os licitantes, conforme decisao
fundamentada no art. 49, caput, assegurado o prazo previsto no art. 109, inciso I, c, da Lei no
8.666/93. A integra do documento esta disponivel no site www.pcdf.df.gov.br, link licitacoes. Maiores
informacoes na CPL/PCDF fones: 3207-4071/4046.
Brasilia/DF, 1o de agosto de 2019.
SILVERIO ANTONIO MOITA DE ANDRADE
Diretor",42244,"[{""start"": 40, ""end"": 47, ""text"": ""14/2019"", ""labels"": [""numero_licitacao""]}, {""start"": 19, ""end"": 36, ""text"": ""PREGAO ELETRONICO"", ""labels"": [""modalidade_licitacao""]}, {""start"": 58, ""end"": 75, ""text"": ""0052.002.099/2016"", ""labels"": [""processo_gdf""]}, {""start"": 233, ""end"": 237, ""text"": ""PCDF"", ""labels"": [""orgao_licitante""]}, {""start"": 909, ""end"": 942, ""text"": ""SILVERIO ANTONIO MOITA DE ANDRADE"", ""labels"": [""nome_responsavel""]}, {""start"": 425, ""end"": 433, ""text"": ""revogado"", ""labels"": [""identificacao_ocorrencia""]}]",3,28036,2022-09-30T18:12:06.418268Z,2022-09-30T18:12:06.418281Z,
"AVISO DE REVOGACAO
PREGAO ELETRONICO No 150/2018 - SRP - UASG 925041
Processo: 00410-00008137-27 - SEEC/DF. O pregoeiro comunica que o pregao acima citado foi
revogado, com fulcro no art. 49 da Lei Federal n. o 8.666/93 e na Nota Tecnica no 27/2019 - AJL,
acolhido pela Autoridade competente, devidamente fundamentado e constante dos autos. Maiores
Informacoes: Coordenacoes de Licitacoes - COLIC/SEEC - DF, telefone: 0xx(61) 3313-8494.
Brasilia/DF, 08 de outubro de 2019.
EDSON DE SOUZA
Coordenador",42243,"[{""start"": 19, ""end"": 36, ""text"": ""PREGAO ELETRONICO"", ""labels"": [""modalidade_licitacao""]}, {""start"": 79, ""end"": 96, ""text"": ""00410-00008137-27"", ""labels"": [""processo_gdf""]}, {""start"": 159, ""end"": 167, ""text"": ""revogado"", ""labels"": [""identificacao_ocorrencia""]}, {""start"": 473, ""end"": 487, ""text"": ""EDSON DE SOUZA"", ""labels"": [""nome_responsavel""]}, {""start"": 99, ""end"": 106, ""text"": ""SEEC/DF"", ""labels"": [""orgao_licitante""]}, {""start"": 40, ""end"": 48, ""text"": ""150/2018"", ""labels"": [""numero_licitacao""]}]",3,28035,2022-09-30T18:12:06.418188Z,2022-09-30T18:12:06.418201Z,
"AVISO DE REVOGACAO
EDITAL DE CONCORRENCIA N 12/2018 - CRIXA
A Comissao Permanente de Licitacao - CPL/CODHAB comunica aos interessados que o Diretor-
Presidente/CODHAB decidiu revogar o Edital de Concorrencia n 12/2018, processo n.o 0392-0003741/2018-
69 cujo objeto e a contratacao de empresa para a execucao das obras de implantacao de infraestrutura externa
(sistemas de abastecimento de agua potavel e esgotamento sanitario, Drenagem e pavimentacao) ao
empreendimento situado no Bairro Crixas em Sao Sebastiao, uma vez que o objeto nao mais atende suas
necessidades atuais, consubstanciando sua decisao no Despacho SEI-GDF CODHAB/PRESI/CPL devidamente
fundamentado na Despacho SEI-GDF CODHAB/PRESI/SECEX e com fulcro no caput do art. 49 da Lei
8.666/93 e Sumula 473 do STF, estando o processo a disposicao no Portal de Sistema Eletronico de Informacoes
- SEI. Fica assegurado o direito a ampla defesa e ao contraditorio, nos termos do  3o, art. 49 c/c a alinea ""c"",
inciso I do art. 109, da citada Lei. Transcorrido o prazo concedido para a ampla defesa e o contraditorio sem
manifestacao o ato da Revogacao restara consumado.
Brasilia/DF, 26 de dezembro de 2018
GILSON PARANHOS
D i r e t o r- P r e s i d e n t e",42242,"[{""start"": 29, ""end"": 41, ""text"": ""CONCORRENCIA"", ""labels"": [""modalidade_licitacao""]}, {""start"": 44, ""end"": 59, ""text"": ""12/2018 - CRIXA"", ""labels"": [""numero_licitacao""]}, {""start"": 175, ""end"": 182, ""text"": ""revogar"", ""labels"": [""identificacao_ocorrencia""]}, {""start"": 195, ""end"": 207, ""text"": ""Concorrencia"", ""labels"": [""modalidade_licitacao""]}, {""start"": 210, ""end"": 217, ""text"": ""12/2018"", ""labels"": [""numero_licitacao""]}, {""start"": 232, ""end"": 253, ""text"": ""0392-0003741/2018-\n69"", ""labels"": [""processo_gdf""]}, {""start"": 1166, ""end"": 1181, ""text"": ""GILSON PARANHOS"", ""labels"": [""nome_responsavel""]}]",3,28034,2022-09-30T18:12:06.418090Z,2022-09-30T18:12:06.418105Z,
"AVISO DE ANULACAO
PREGAO ELETRONICO No 37/2019
Processo No 00053-00050726/2019-41/CBMDF. TIPO: Menor preco. OBJETO: Contratacao de empresa
especializada para realizar servicos continuados de manutencao, reparo e reposicao de pecas e fluidos
originais dos equipamentos e aparelhos odontologicos da Policlinica Odontologica do CBMDF,
conforme especificacoes e condicoes estabelecidas no Termo de Referencia constante do Anexo I do
Edital. O DICOA informa a ANULACAO do item 6.8 do edital; do item 5.8 do termo de referencia;
da tabela do item 5.6 do termo de referencia e a fase externa da licitacao do pregao em epigrafe, com
fulcro no item 16.6 do edital c/c, art. 49 da Lei no 8.666/1993, art. 29 do Decreto no 5.450/2005 e
art. 53 da Lei no 9.784/1999, em razao da existencia de vicios insanaveis no certame conforme aponta
o Relatorio de Analise do Pregoeiro. Visto o art. 109, I, ""c"", da Lei 8.666/1993, fica aberto o prazo
recursal de 5 (cinco) dias uteis. Inf.: (61) 3901-3481.
MARCELO TEIXEIRA DANTAS
Diretor",42241,"[{""start"": 39, ""end"": 46, ""text"": ""37/2019"", ""labels"": [""numero_licitacao""]}, {""start"": 59, ""end"": 81, ""text"": ""00053-00050726/2019-41"", ""labels"": [""processo_gdf""]}, {""start"": 18, ""end"": 35, ""text"": ""PREGAO ELETRONICO"", ""labels"": [""modalidade_licitacao""]}, {""start"": 455, ""end"": 463, ""text"": ""ANULACAO"", ""labels"": [""identificacao_ocorrencia""]}, {""start"": 325, ""end"": 330, ""text"": ""CBMDF"", ""labels"": [""orgao_licitante""]}, {""start"": 984, ""end"": 1007, ""text"": ""MARCELO TEIXEIRA DANTAS"", ""labels"": [""nome_responsavel""]}]",3,28033,2022-09-30T18:12:06.417993Z,2022-09-30T18:12:06.418008Z,
"AVISO DE ANULAÇÃO DO PREGÃO ELETRÔNICO SRP Nº 07/2021
O DIRETOR-PRESIDENTE DA COMPANHIA DE DESENVOLVIMENTO HABITACIONAL DO DISTRITO FEDERAL, comunica aos interessados a ANULAÇÃO do Pregão Eletrônico nº 07/2021, cujo objeto trata de contratação de empresa ou consórcio de empresas para prestação de serviços técnicos para a elaboração de estudos e projetos para regularização fundiária e urbana da Área de Interesse Social - ARIS Sol Nascente, para atender a Companhia de Desenvolvimento Habitacional do Distrito Federal   CODHAB/DF, conforme descrito no Anexo I do Edital, referente ao processo 00392-00007567/2021-29 Destaque-se que está disponível no sistema Comprasnet o evento de Anulação do certame em 16/02/2022, como procedimento para atendimento da Decisão 152/2022 TCDF.

Brasília/DF, 15 de fevereiro de 2022

WELLINGTON LUIZ",42240,"[{""start"": 21, ""end"": 38, ""text"": ""PREGÃO ELETRÔNICO"", ""labels"": [""modalidade_licitacao""]}, {""start"": 46, ""end"": 53, ""text"": ""07/2021"", ""labels"": [""numero_licitacao""]}, {""start"": 202, ""end"": 209, ""text"": ""07/2021"", ""labels"": [""numero_licitacao""]}, {""start"": 78, ""end"": 139, ""text"": ""COMPANHIA DE DESENVOLVIMENTO HABITACIONAL DO DISTRITO FEDERAL"", ""labels"": [""orgao_licitante""]}, {""start"": 169, ""end"": 177, ""text"": ""ANULAÇÃO"", ""labels"": [""identificacao_ocorrencia""]}, {""start"": 181, ""end"": 198, ""text"": ""Pregão Eletrônico"", ""labels"": [""modalidade_licitacao""]}, {""start"": 458, ""end"": 519, ""text"": ""Companhia de Desenvolvimento Habitacional do Distrito Federal"", ""labels"": [""orgao_licitante""]}, {""start"": 595, ""end"": 617, ""text"": ""00392-00007567/2021-29"", ""labels"": [""processo_gdf""]}, {""start"": 794, ""end"": 817, ""text"": ""15 de fevereiro de 2022"", ""labels"": [""data_escrito""]}, {""start"": 819, ""end"": 834, ""text"": ""WELLINGTON LUIZ"", ""labels"": [""nome_responsavel""]}]",3,28032,2022-09-30T18:12:06.417899Z,2022-09-30T18:12:06.417915Z,
"AVISO DE REVOGAÇÃO DE PREGÃO ELETRÔNICO Nº 04/2021
Processo: 00074-00000002/2020-97. OBJETO: Venda de madeira em pé da espécie Pinus sp, com corte e retirada do insumo no local, conforme especificações, condições e exigências estabelecidas no Edital nº 04/2021 e seus anexos. Em razão da impossibilidade de prosseguimento do certame em decorrência da falha de sistema relatada na Nota Técnica CAIXA - NT_0004_2021_CEPEM 08_12_2021 (75803745), REVOGA-SE o Pregão Eletrônico nº 04/2021, a que se refere o Edital de Licitação 04/2021 (67386008).

SALVADOR CARDOSO

Pregoeiro",42239,"[{""start"": 22, ""end"": 39, ""text"": ""PREGÃO ELETRÔNICO"", ""labels"": [""modalidade_licitacao""]}, {""start"": 455, ""end"": 472, ""text"": ""Pregão Eletrônico"", ""labels"": [""modalidade_licitacao""]}, {""start"": 43, ""end"": 50, ""text"": ""04/2021"", ""labels"": [""numero_licitacao""]}, {""start"": 476, ""end"": 483, ""text"": ""04/2021"", ""labels"": [""numero_licitacao""]}, {""start"": 61, ""end"": 83, ""text"": ""00074-00000002/2020-97"", ""labels"": [""processo_gdf""]}, {""start"": 443, ""end"": 452, ""text"": ""REVOGA-SE"", ""labels"": [""identificacao_ocorrencia""]}, {""start"": 544, ""end"": 560, ""text"": ""SALVADOR CARDOSO"", ""labels"": [""nome_responsavel""]}]",3,28031,2022-09-30T18:12:06.417792Z,2022-09-30T18:12:06.417807Z,
"AVISO DE ANULAÇÃO PREGÃO ELETRÔNICO Nº 02/2021 - UASG: 926319
A Pregoeira da Fundação de Apoio à Pesquisa do Distrito Federal, comunica a anulação do certame licitatório oriundo do Edital de Licitação do Pregão Eletrônico nº 0002/2021 - SUAG/DGA/FAPDF - EXCLUSIVO ME/EPP. Informamos que serão feitas as devidas alterações para a continuidade dos procedimentos. Processo 00193-00000432/2021-05. Os autos ficam com vistas franqueadas aos interessados, nesta Fundação de Apoio à Pesquisa do Distrito Federal, pelo e-mail: cpl@fap.df.gov.br.

Brasília/DF, 24 de setembro de 2021

MARCILENE BONFIM LEITÃO SANTANA",42238,"[{""start"": 18, ""end"": 35, ""text"": ""PREGÃO ELETRÔNICO"", ""labels"": [""modalidade_licitacao""]}, {""start"": 204, ""end"": 221, ""text"": ""Pregão Eletrônico"", ""labels"": [""modalidade_licitacao""]}, {""start"": 39, ""end"": 46, ""text"": ""02/2021"", ""labels"": [""numero_licitacao""]}, {""start"": 77, ""end"": 125, ""text"": ""Fundação de Apoio à Pesquisa do Distrito Federal"", ""labels"": [""orgao_licitante""]}, {""start"": 456, ""end"": 504, ""text"": ""Fundação de Apoio à Pesquisa do Distrito Federal"", ""labels"": [""orgao_licitante""]}, {""start"": 138, ""end"": 146, ""text"": ""anulação"", ""labels"": [""identificacao_ocorrencia""]}, {""start"": 225, ""end"": 234, ""text"": ""0002/2021"", ""labels"": [""numero_licitacao""]}, {""start"": 370, ""end"": 392, ""text"": ""00193-00000432/2021-05"", ""labels"": [""processo_gdf""]}, {""start"": 552, ""end"": 574, ""text"": ""24 de setembro de 2021"", ""labels"": [""data_escrito""]}, {""start"": 576, ""end"": 607, ""text"": ""MARCILENE BONFIM LEITÃO SANTANA"", ""labels"": [""nome_responsavel""]}]",3,28030,2022-09-30T18:12:06.417695Z,2022-09-30T18:12:06.417711Z,
