text,id,label,annotator,annotation_id,created_at,updated_at,lead_time
"EXTRATOS DE CONVENIOS
Especie: Convenio n 002/2018-SES/DF. Convenentes: DISTRITO FEDERAL, por inter-
medio de sua SECRETARIA DE ESTADO DE SAUDE DO DISTRITO FEDERAL e a
FUNDACAO OSWALDO CRUZ doravante denominada FIOCRUZ, inscrita no CNPJ/MF
sob o no 33.781.055/0001-35, vinculada ao Ministerio da Saude, por meio ESCOLA NA-
CIONAL DE SAUDE PUBLICA SERGIO AROUCA, doravante denominada FIO-
CRUZ/ENSP. Objeto: O presente convenio tem por objetivo formar especialistas em ava-
liacao em saude por meio da realizacao do Curso ""Especializacao em Avaliacao em Saude"",
na modalidade a Distancia tendo como foco as politicas (planos, programas, projetos e
acoes), os servicos (estruturas, processos e resultados) e as redes de atencao a saude, voltado
para profissionais de nivel superior, prioritariamente para os servidores da Secretaria de
Estado de Saude do Distrito Federal e as remanescentes para profissionais que atuem na
Secretaria de Estado de Planejamento, Orcamento e Gestao do Distrito Federal. Vigencia: O
presente Convenio vigera a partir de sua data de assinatura, pelo periodo de 24 (vinte e
quatro) meses, podendo ser prorrogado por meio de termo aditivo, apos analise tecnica de
acordo com o interesse dos participes; O Convenio podera ser alterado a qualquer tempo,
mediante assinatura de termo aditivo, desde que nao seja modificado seu objeto, devendo a
solicitacao ser encaminhada com antecedencia minima de 60 (sessenta) dias da data de
termino da execucao do Convenio. Valor: Para o cumprimento das metas estabelecidas neste
Convenio, foi estabelecido o valor de R$ 915.500,00 (novecentos e quinze mil e quinhentos
reais), a ser transferido para a FUNDACAO OSWALDO CRUZ/ ESCOLA NACIONAL DE
SAUDE PUBLICA SERGIO AROUCA (FIOCRUZ/ENSP), de acordo com o cronograma de
Desembolso fixado no Plano de Trabalho/Projeto Basico. Dotacao Orcamentaria: Unidade
Orcamentaria: 23901. Unidade Gestora: 170101. Gestao: 17901. Programa de Tr a b a l h o :
10128600240880021. Natureza da Despesa: 332039. Fonte de Recurso: 100000000. Despesa
de Publicacao: A publicacao do presente instrumento sera providenciada pela SES/DF, em
extrato no Diario Oficial do Distrito Federal e pela FIOCRUZ/ENSP no Diario Oficial da
Uniao, as suas expensas, ate o 5o (quinto) dia util do mes seguinte ao de sua assinatura,
devendo esta ocorrer no prazo de 20 (vinte) dias a contar daquela data. Do Plano de
Trabalho/Do Projeto Basico: Integra este Instrumento, independentemente de transcricao, o
Projeto Basico/Plano de Trabalho, elaborado e aprovado de comum acordo entre as partes,",44458,"[{""start"": 114, ""end"": 163, ""text"": ""SECRETARIA DE ESTADO DE SAUDE DO DISTRITO FEDERAL"", ""labels"": [""orgao_concedente""]}, {""start"": 168, ""end"": 189, ""text"": ""FUNDACAO OSWALDO CRUZ"", ""labels"": [""entidade_convenente""]}, {""start"": 249, ""end"": 267, ""text"": ""33.781.055/0001-35"", ""labels"": [""cnpj_entidade_convenente""]}, {""start"": 407, ""end"": 997, ""text"": ""O presente convenio tem por objetivo formar especialistas em ava-\nliacao em saude por meio da realizacao do Curso \""Especializacao em Avaliacao em Saude\"",\nna modalidade a Distancia tendo como foco as politicas (planos, programas, projetos e\nacoes), os servicos (estruturas, processos e resultados) e as redes de atencao a saude, voltado\npara profissionais de nivel superior, prioritariamente para os servidores da Secretaria de\nEstado de Saude do Distrito Federal e as remanescentes para profissionais que atuem na\nSecretaria de Estado de Planejamento, Orcamento e Gestao do Distrito Federal"", ""labels"": [""objeto_contrato""]}, {""start"": 1036, ""end"": 1070, ""text"": ""a partir de sua data de assinatura"", ""labels"": [""vigencia_contrato""]}, {""start"": 1088, ""end"": 1113, ""text"": ""24 (vinte e\nquatro) meses"", ""labels"": [""vigencia_convenio""]}, {""start"": 1879, ""end"": 1884, ""text"": ""23901"", ""labels"": [""unidade_orcamentaria""]}, {""start"": 2021, ""end"": 2030, ""text"": ""100000000"", ""labels"": [""fonte_recurso""]}, {""start"": 1582, ""end"": 1592, ""text"": ""915.500,00"", ""labels"": [""valor_convenio""]}, {""start"": 1995, ""end"": 2001, ""text"": ""332039"", ""labels"": [""natureza_despesa""]}, {""start"": 1955, ""end"": 1972, ""text"": ""10128600240880021"", ""labels"": [""programa_trabalho""]}, {""start"": 42, ""end"": 57, ""text"": ""002/2018-SES/DF"", ""labels"": [""numero_convenio""]}]",3,30250,2022-09-30T18:38:46.326819Z,2022-09-30T18:38:46.326839Z,
"Especie: Convenio n 003/2018-SES/DF. Convenentes: DISTRITO FEDERAL, por inter-
medio de sua SECRETARIA DE ESTADO DE SAUDE DO DISTRITO FEDERAL e a
FUNDACAO OSWALDO CRUZ doravante denominada FIOCRUZ, inscrita no CNPJ/MF
sob o no 33.781.055/0001-35, vinculada ao Ministerio da Saude, por meio ESCOLA NA-
CIONAL DE SAUDE PUBLICA SERGIO AROUCA, doravante denominada FIO-
CRUZ/ENSP. Objeto: O presente convenio tem por objeto a formacao de mestres em
avaliacao em saude por meio da realizacao do Curso ""Mestrado Profissional em Avaliacao
em Saude"", na modalidade presencial tendo como foco as politicas, programas, projetos e
acoes, os servicos e as redes de atencao a saude. Vigencia: O presente Convenio vigera a
partir de sua data de assinatura, pelo periodo de 30 (trinta) meses, podendo ser prorrogado
por meio de termo aditivo, apos analise tecnica de acordo com o interesse dos participes; O
Convenio podera ser alterado a qualquer tempo, mediante assinatura de termo aditivo, desde
que nao seja modificado seu objeto, devendo a solicitacao ser encaminhada com ante-
cedencia minima de 60 (sessenta) dias da data de termino da execucao do Convenio. Valor:
Para o cumprimento das metas estabelecidas neste Convenio, foi estabelecido o valor de R$
788.070,81 (setecentos e oitenta e oito mil e setenta reais e oitenta e um centavos), a ser
transferido para a FUNDACAO OSWALDO CRUZ/ ESCOLA NACIONAL DE SAUDE
PUBLICA SERGIO AROUCA (FIOCRUZ/ENSP), de acordo com o cronograma de De-
sembolso fixado no Plano de Trabalho/Projeto Basico. Dotacao Orcamentaria: Unidade
Orcamentaria: 23901. Unidade Gestora: 170101. Gestao: 17901. Programa de Tr a b a l h o :
10128600240880021. Natureza da Despesa: 332039. Fonte de Recurso: 100000000. Despesa
de Publicacao: A publicacao do presente instrumento sera providenciada pela SES/DF, em
extrato no Diario Oficial do Distrito Federal e pela FIOCRUZ/ENSP no Diario Oficial da
Uniao, as suas expensas, ate o 5o (quinto) dia util do mes seguinte ao de sua assinatura,
devendo esta ocorrer no prazo de 20 (vinte) dias a contar daquela data. Do Plano de
Trabalho/Do Projeto Basico: Integra este Instrumento, independentemente de transcricao, o
Projeto Basico/Plano de Trabalho, (9207576) elaborado e aprovado de comum acordo entre
as partes, concernente a execucao da finalidade descrita na Clausula do Objeto. Processo SEI
no: 00060-00220965/2017-50 Processo Fiocruz no 25380.001551/2017-41. Data de Assi-
natura: 04/07/2018. Pela SES/DF: HUMBERTO LUCENA PEREIRA DA FONSECA. Pela
FIOCRUZ: HERMANO ALBUQUERQUE DE CASTRO. Testemunhas: PATRICIA SILVA
ARAUJO RESENDE e ALDA SOUZA RODRIGUES.",44457,"[{""start"": 20, ""end"": 35, ""text"": ""003/2018-SES/DF"", ""labels"": [""numero_convenio""]}, {""start"": 92, ""end"": 141, ""text"": ""SECRETARIA DE ESTADO DE SAUDE DO DISTRITO FEDERAL"", ""labels"": [""orgao_concedente""]}, {""start"": 146, ""end"": 167, ""text"": ""FUNDACAO OSWALDO CRUZ"", ""labels"": [""entidade_convenente""]}, {""start"": 227, ""end"": 245, ""text"": ""33.781.055/0001-35"", ""labels"": [""cnpj_entidade_convenente""]}, {""start"": 385, ""end"": 668, ""text"": ""O presente convenio tem por objeto a formacao de mestres em\navaliacao em saude por meio da realizacao do Curso \""Mestrado Profissional em Avaliacao\nem Saude\"", na modalidade presencial tendo como foco as politicas, programas, projetos e\nacoes, os servicos e as redes de atencao a saude"", ""labels"": [""objeto_convenio""]}, {""start"": 707, ""end"": 776, ""text"": ""a\npartir de sua data de assinatura, pelo periodo de 30 (trinta) meses"", ""labels"": [""vigencia_convenio""]}, {""start"": 1247, ""end"": 1257, ""text"": ""788.070,81"", ""labels"": [""valor_convenio""]}, {""start"": 1691, ""end"": 1697, ""text"": ""332039"", ""labels"": [""natureza_despesa""]}, {""start"": 1717, ""end"": 1726, ""text"": ""100000000"", ""labels"": [""fonte_recurso""]}, {""start"": 1651, ""end"": 1668, ""text"": ""10128600240880021"", ""labels"": [""programa_trabalho""]}, {""start"": 1575, ""end"": 1580, ""text"": ""23901"", ""labels"": [""unidade_orcamentaria""]}, {""start"": 2445, ""end"": 2455, ""text"": ""04/07/2018"", ""labels"": [""data_assinatura_convenio""]}, {""start"": 2358, ""end"": 2380, ""text"": ""00060-00220965/2017-50"", ""labels"": [""processo_gdf""]}]",3,30249,2022-09-30T18:38:46.326677Z,2022-09-30T18:38:46.326696Z,
"EXTRATO DE TERMO DE CONVENIO DE ESTAGIO
Processo SEI no 00072.00001907/2018-16. Instrumento: Convenio no 001/201 8 - G C O N V.
Partes: EMPRESA DE ASSISTENCIA TECNICA E EXTENSAO RURAL DO DISTRITO
FEDERAL - EMATER-DF e a FACULDADES INTEGRADAS DA UNIAO EDUCA-
CIONAL DO PLANALTO CENTRAL- FACIPLAC. Objeto: Propiciar estagios curriculares
e extracurriculares aos estudantes de Nivel Superior, visando a conclusao dos cursos de
Graduacao  oferecidos pela  instituicao  de  ensino. Assinatura:  30/04/2018. Vi g e n -
cia:30/04/2023. Signatarios: P/EMATER-DF-Roberto Guimaraes Carneiro. P / FA C I P L A C :
Walter Paulo Filho- Diretor Geral.",44456,"[{""start"": 105, ""end"": 114, ""text"": ""001/201 8"", ""labels"": [""numero_convenio""]}, {""start"": 136, ""end"": 215, ""text"": ""EMPRESA DE ASSISTENCIA TECNICA E EXTENSAO RURAL DO DISTRITO\nFEDERAL - EMATER-DF"", ""labels"": [""orgao_concedente""]}, {""start"": 220, ""end"": 294, ""text"": ""FACULDADES INTEGRADAS DA UNIAO EDUCA-\nCIONAL DO PLANALTO CENTRAL- FACIPLAC"", ""labels"": [""entidade_convenente""]}, {""start"": 304, ""end"": 475, ""text"": ""Propiciar estagios curriculares\ne extracurriculares aos estudantes de Nivel Superior, visando a conclusao dos cursos de\nGraduacao  oferecidos pela  instituicao  de  ensino"", ""labels"": [""objeto_convenio""]}, {""start"": 490, ""end"": 500, ""text"": ""30/04/2018"", ""labels"": [""data_assinatura_convenio""]}, {""start"": 517, ""end"": 527, ""text"": ""30/04/2023"", ""labels"": [""vigencia_convenio""]}, {""start"": 56, ""end"": 78, ""text"": ""00072.00001907/2018-16"", ""labels"": [""processo_gdf""]}]",3,30248,2022-09-30T18:38:46.326530Z,2022-09-30T18:38:46.326550Z,
"EXTRATO DE CONVENIO CELEBRADO EM 10.12.2018
Convenente: Tribunal de Contas do Distrito Federal - CNPJ no 00.534.560/0001-26 - Instituicao
Conveniada: BANCO BRADESCO S.A. - CNPJ no: 60.746.948/0001-12 - Objeto: consignacao em folha
de pagamento dos membros e servidores, ativos e inativos e dos pensionistas do CONVENENTE com
vistas a disponibilizacao de linha de emprestimo pessoal - Processo TCDF no 32.8362018-e - Fundamento
Legal: Resolucao no 199/2009, alterada pelas Resolucoes no 210/2010 e 247/2012 do TCDF - Vigencia e
Execucao: de 10/12/2018 a 09/12/2023 - Valor: R$ 0,00 (zero reais) - Data da assinatura: 10/12/2018 -
Assinam: pelo TCDF, PAULO CAVALCANTI DE OLIVEIRA e, pelo BANCO BRADESCO S.A, JOAO
SEGUNDO DA COSTA NETO e MICHELLE DE MELLO SOUZA DUARTE.",44455,"[{""start"": 56, ""end"": 94, ""text"": ""Tribunal de Contas do Distrito Federal"", ""labels"": [""orgao_concedente""]}, {""start"": 105, ""end"": 123, ""text"": ""00.534.560/0001-26"", ""labels"": [""cnpj_orgao_concedente""]}, {""start"": 150, ""end"": 169, ""text"": ""BANCO BRADESCO S.A."", ""labels"": [""entidade_convenente""]}, {""start"": 181, ""end"": 199, ""text"": ""60.746.948/0001-12"", ""labels"": [""cnpj_entidade_convenente""]}, {""start"": 210, ""end"": 381, ""text"": ""consignacao em folha\nde pagamento dos membros e servidores, ativos e inativos e dos pensionistas do CONVENENTE com\nvistas a disponibilizacao de linha de emprestimo pessoal"", ""labels"": [""objeto_contrato""]}, {""start"": 540, ""end"": 563, ""text"": ""10/12/2018 a 09/12/2023"", ""labels"": [""vigencia_convenio""]}, {""start"": 616, ""end"": 626, ""text"": ""10/12/2018"", ""labels"": [""data_assinatura_contrato""]}, {""start"": 576, ""end"": 580, ""text"": ""0,00"", ""labels"": [""valor_convenio""]}, {""start"": 401, ""end"": 411, ""text"": ""32.8362018"", ""labels"": [""processo_gdf""]}]",3,30247,2022-09-30T18:38:46.326410Z,2022-09-30T18:38:46.326429Z,
"EXTRATO DE CONVÊNIO Nº 01/2021
Convenente: FUNDAÇÃO HEMOCENTRO DE BRASÍLIA - CNPJ nº 86.743.457/0001-01, Conveniada: HOSPITAL UNIVERSITÁRIO DE BRASÍLIA - EBSERH - CNPJ nº 15.126.437/0003-05. Objeto: Suporte hemoterápico pela FHB à FUC para realização de transplantes de Células Progenitoras Hematopoiéticas - CPH (medula óssea e sangue periférico) a pacientes do Sistema Único de Saúde. Processo 00063-00002120/2019-61. Vigência: 12 (doze) meses a contar da data de sua assinatura. Assinam, em 11 de agosto de 2021, pelo: BÁRBARA DE JESUS SIMÕES, Presidente, e pela Conveniada: ELZA FERREIRA NORONHA,  RODOLFO BORGES DE LIRA e FLÁVIA DIAS XAVIER.",44454,"[{""start"": 23, ""end"": 30, ""text"": ""01/2021"", ""labels"": [""numero_convenio""]}, {""start"": 43, ""end"": 74, ""text"": ""FUNDAÇÃO HEMOCENTRO DE BRASÍLIA"", ""labels"": [""entidade_convenente""]}, {""start"": 85, ""end"": 103, ""text"": ""86.743.457/0001-01"", ""labels"": [""cnpj_entidade_convenente""]}, {""start"": 199, ""end"": 386, ""text"": ""Suporte hemoterápico pela FHB à FUC para realização de transplantes de Células Progenitoras Hematopoiéticas - CPH (medula óssea e sangue periférico) a pacientes do Sistema Único de Saúde."", ""labels"": [""objeto_convenio""]}, {""start"": 396, ""end"": 418, ""text"": ""00063-00002120/2019-61"", ""labels"": [""entidade_convenente""]}, {""start"": 494, ""end"": 514, ""text"": ""11 de agosto de 2021"", ""labels"": [""data_assinatura_convenio""]}, {""start"": 430, ""end"": 480, ""text"": ""12 (doze) meses a contar da data de sua assinatura"", ""labels"": [""vigencia_convenio""]}]",3,30246,2022-09-30T18:38:46.326284Z,2022-09-30T18:38:46.326303Z,
"EXTRATO DE CONVÊNIO PLATAFORMA + BRASIL Nº 905437/2020
Processo: 00431-00017207/2020-50. ESPÉCIE: Convênio Federal nº 905437/2020, celebrado entre a União, por meio do Ministério da Cidadania, CNPJ nº 05.526.783/0001-65, e a Secretaria de Estado de Desenvolvimento Social do Distrito Federal - SEDES/DF, CNPJ nº 04.251.080/0001-09. OBJETO: O presente Convênio tem por objeto qualificar a execução da Política Nacional de SAN no Distrito Federal e fortalecer a gestão estadual do SISAN. VALOR GLOBAL: R$ 515.000,00 (quinhentos e quinze mil reais), sendo R$ 500.000,00 (quinhentos mil reais) da Concedente e R$ 15.000,00 (quinze mil reais), a título de Contrapartida, da Convenente. O valor da Concedente, autorizado pela Lei nº 13.978, de 17 de janeiro de 2020, publicada no Diário Oficial da União de 20 de janeiro de 2020, UG 550008, assegurado pelas Notas de Empenho nº 2020NE800056, 2020NE800058 e 2020NE800080, vinculadas aos Programas de Trabalho nº 08.306.5033.2784.0001 - Promoção do Consumo de Alimentos Adequados e Saudáveis e nº 08.306.5033.215I.0001 - Consolidação da Implantação do Sistema Nacional de Segurança Alimentar e Nutricional (SISAN), PTRES 174595, 174594 e 191315, respectivamente, à conta de recursos oriundos do Tesouro Nacional, Fonte de Recursos 0151, Natureza da Despesa 333041 e 443041; e o valor da contrapartida do Convenente, consignados na Lei nº 6.490, de 29 de janeiro de 2020, do Governo do Distrito Federal. VIGÊNCIA: Este Termo de Convênio vigorará, a partir da data de sua assinatura, até 19 de dezembro de 2023. DATA DA ASSINATURA: 24/12/2020. SIGNATÁRIOS: Pelo Concedente: ÊNIO ANTÔNIO MARQUES PEREIRA, Secretário Nacional de Inclusão Social e Produtiva; Pela Convenente: MAYARA NORONHA DE ALBUQUERQUE, Secretária de Estado de Desenvolvimento Social do Distrito Federal.",44453,"[{""start"": 43, ""end"": 54, ""text"": ""905437/2020"", ""labels"": [""numero_convenio""]}, {""start"": 65, ""end"": 87, ""text"": ""00431-00017207/2020-50"", ""labels"": [""processo_gdf""]}, {""start"": 201, ""end"": 219, ""text"": ""05.526.783/0001-65"", ""labels"": [""cnpj_entidade_convenente""]}, {""start"": 225, ""end"": 302, ""text"": ""Secretaria de Estado de Desenvolvimento Social do Distrito Federal - SEDES/DF"", ""labels"": [""orgao_concedente""]}, {""start"": 312, ""end"": 330, ""text"": ""04.251.080/0001-09"", ""labels"": [""cnpj_orgao_concedente""]}, {""start"": 340, ""end"": 484, ""text"": ""O presente Convênio tem por objeto qualificar a execução da Política Nacional de SAN no Distrito Federal e fortalecer a gestão estadual do SISAN"", ""labels"": [""objeto_convenio""]}, {""start"": 503, ""end"": 513, ""text"": ""515.000,00"", ""labels"": [""valor_convenio""]}, {""start"": 872, ""end"": 884, ""text"": ""2020NE800056"", ""labels"": [""nota_empenho""]}, {""start"": 886, ""end"": 898, ""text"": ""2020NE800058"", ""labels"": [""nota_empenho""]}, {""start"": 901, ""end"": 913, ""text"": ""2020NE800080"", ""labels"": [""nota_empenho""]}, {""start"": 955, ""end"": 976, ""text"": ""08.306.5033.2784.0001"", ""labels"": [""programa_trabalho""]}, {""start"": 1299, ""end"": 1305, ""text"": ""333041"", ""labels"": [""natureza_despesa""]}, {""start"": 1308, ""end"": 1314, ""text"": ""443041"", ""labels"": [""natureza_despesa""]}, {""start"": 1455, ""end"": 1550, ""text"": ""Este Termo de Convênio vigorará, a partir da data de sua assinatura, até 19 de dezembro de 2023"", ""labels"": [""vigencia_convenio""]}, {""start"": 1572, ""end"": 1582, ""text"": ""24/12/2020"", ""labels"": [""data_assinatura_convenio""]}, {""start"": 118, ""end"": 129, ""text"": ""905437/2020"", ""labels"": [""numero_convenio""]}, {""start"": 168, ""end"": 191, ""text"": ""Ministério da Cidadania"", ""labels"": [""entidade_convenente""]}]",3,30245,2022-09-30T18:38:46.326163Z,2022-09-30T18:38:46.326182Z,
"EXTRATO DE CONVÊNIO CELEBRADO EM 27/10/2021
Convenente: Tribunal de Contas do Distrito Federal   CNPJ nº 00.534.560/0001-26 - Instituição Conveniada: KOVR PREVIDÊNCIA S.A.   CNPJ nº 17.479.056/0001-73 - Objeto: disponibilização de linha de planos previdenciários e de planos de seguros mediante consignação em folha de pagamento aos membros, servidores ativos, inativos e aos pensionistas do CONVENENTE   Processo TCDF nº 24562/2008   Fundamento Legal: Resolução nº 199/2009 do TCDF e alterações - Vigência e Execução: de 27/10/2021 a 26/10/2026   Valor: R$0,00 (zero reais)   Data da assinatura: 27/10/2021   Assinam: pelo Convenente, Paulo Cavalcanti de Oliveira; e, pela Instituição Conveniada, Geraldo Henrique de Castro.",44452,"[{""start"": 56, ""end"": 94, ""text"": ""Tribunal de Contas do Distrito Federal"", ""labels"": [""entidade_convenente""]}, {""start"": 105, ""end"": 123, ""text"": ""00.534.560/0001-26"", ""labels"": [""cnpj_entidade_convenente""]}, {""start"": 211, ""end"": 402, ""text"": ""disponibilização de linha de planos previdenciários e de planos de seguros mediante consignação em folha de pagamento aos membros, servidores ativos, inativos e aos pensionistas do CONVENENTE"", ""labels"": [""objeto_convenio""]}, {""start"": 422, ""end"": 432, ""text"": ""24562/2008"", ""labels"": [""processo_gdf""]}, {""start"": 519, ""end"": 545, ""text"": ""de 27/10/2021 a 26/10/2026"", ""labels"": [""vigencia_convenio""]}, {""start"": 557, ""end"": 561, ""text"": ""0,00"", ""labels"": [""valor_convenio""]}, {""start"": 597, ""end"": 607, ""text"": ""27/10/2021"", ""labels"": [""data_assinatura_convenio""]}, {""start"": 33, ""end"": 43, ""text"": ""27/10/2021"", ""labels"": [""data_assinatura_convenio""]}]",3,30244,2022-09-30T18:38:46.326002Z,2022-09-30T18:38:46.326021Z,
"EXTRATO DO TERMO DE CONVÊNIO Nº 06/2021
Processo: 04011-00002582/2020-33. PARTES: O DISTRITO FEDERAL, por meio da SECRETARIA DE ESTADO DA MULHER DO DISTRITO FEDERAL, CNPJ nº 15.169.975/0001-15, e a Instituição de Ensino CENTRO UNIVERSITÁRIO DE BRASÍLIA - UniCEUB, CNPJ nº 00.059.857/0001-87. OBJETO: colaboração de estagiários vinculados ao UniCEUB em programa obrigatório de Estágio Curricular Supervisionado de Estudante de Psicologia, a partir do 9º semestre. Vigência: O contrato terá vigência de 12 (dose) meses, a partir de sua assinatura, prorrogáveis por iguais e sucessivos períodos, até o limite de 60 (sessenta) meses. Da Assinatura: 31/08/2021. SIGNATÁRIOS: pela Concedente: VANDERCY ANTONIA DE CAMARGOS, na qualidade de Secretária Executiva; pela Convenente: GETÚLIO AMÉRICO MOREIRA LOPES, na qualidade Diretor Presidente e EDEVALDO ALVES DA SILVA, na qualidade de Diretor Superintendente.",44451,"[{""start"": 32, ""end"": 39, ""text"": ""06/2021"", ""labels"": [""numero_convenio""]}, {""start"": 50, ""end"": 72, ""text"": ""04011-00002582/2020-33"", ""labels"": [""processo_gdf""]}, {""start"": 114, ""end"": 164, ""text"": ""SECRETARIA DE ESTADO DA MULHER DO DISTRITO FEDERAL"", ""labels"": [""entidade_convenente""]}, {""start"": 174, ""end"": 192, ""text"": ""15.169.975/0001-15"", ""labels"": [""cnpj_entidade_convenente""]}, {""start"": 300, ""end"": 461, ""text"": ""colaboração de estagiários vinculados ao UniCEUB em programa obrigatório de Estágio Curricular Supervisionado de Estudante de Psicologia, a partir do 9º semestre"", ""labels"": [""objeto_convenio""]}, {""start"": 473, ""end"": 628, ""text"": ""O contrato terá vigência de 12 (dose) meses, a partir de sua assinatura, prorrogáveis por iguais e sucessivos períodos, até o limite de 60 (sessenta) meses"", ""labels"": [""vigencia_convenio""]}, {""start"": 645, ""end"": 655, ""text"": ""31/08/2021"", ""labels"": [""data_assinatura_convenio""]}]",3,30243,2022-09-30T18:38:46.325850Z,2022-09-30T18:38:46.325875Z,
"EXTRATO DE TERMO DE CONVÊNIO DE ESTÁGIO
Processo: 00400-00022420/2021-02   DAS PARTES: DISTRITO FEDERAL, através da Secretaria de Estado de Justiça e Cidadania e a União Brasileira de Educação Católica. CLÁUSULA PRIMEIRA - DO OBJETO: O Termo de Convênio de Estágio tem por objetivo garantir a oferta de campo de Estágio Curricular Obrigatório que proporcionem a elaboração e execução de ações conjuntas, que beneficiem estudantes e profissionais da universidade e adolescentes e profissionais do sistema socioeducativo. CLÁUSULA SEGUNDA - DO PÚBLICO-ALVO: Estudantes e profissionais vinculados aos cursos de graduação e pós-graduação da União Brasileira de Educação Católica, bem como adolescentes e profissionais do sistema socioeducativo do Distrito Federal como beneficiários indiretos. CLÁUSULA TERCEIRA - DO OBJETIVO GERAL: Estabelecer parceria entre a Secretaria de Estado de Justiça e Cidadania - Sejus e a União Brasileira de Educação Católica para implementação de ações conjuntas que assegurem o desenvolvimento e compartilhamento de estudos, pesquisas, projetos de extensão; a realização de estágios curriculares supervisionados obrigatórios e a produção técnica de interesse comum. CLÁUSULA OITAVA   DA DURAÇÃO E DA CARGA HORÁRIA DO ESTÁGIO: A carga horária, a duração e a jornada do estágio será de no mínimo 03h (três) e no máximo 06h (seis) horas diárias, não excedendo a carga horária semanal de 30 horas. PARÁGRAFO PRIMEIRO: A Sejus deverá oferecer condições para que os estagiários possam cumprir suas obrigações, sem prejuízo das atividades acadêmicas. CLÁUSULA DÉCIMA SEGUNDA  DO VÍNCULO: O estagiário não terá vínculo empregatício de qualquer natureza com a Sejus e a União Brasileira de Educação Católica. CLÁUSULA DÉCIMA QUARTA   DO PRAZO DA VIGÊNCIA: Vigência de 60 meses, contados a partir da data da sua assinatura, e que após essa data caso haja interesse de ambos na sua continuidade, poderá ser providenciado um novo ajuste, observada a legislação vigente. DATA DA ASSINATURA: 15/12/2021. SIGNATÁRIOS: p/Secretaria de Estado de Justiça e Cidadania: JAIME SANTANA DE SOUSA; p/ União Brasileira de Educação Católica: LEANDRO GENOINO CERUTTI, RICARDO PEREIRA CALEGARI e ADRIANA PELIZZARI.",44450,"[{""start"": 50, ""end"": 72, ""text"": ""00400-00022420/2021-02"", ""labels"": [""processo_gdf""]}, {""start"": 116, ""end"": 159, ""text"": ""Secretaria de Estado de Justiça e Cidadania"", ""labels"": [""entidade_convenente""]}, {""start"": 234, ""end"": 518, ""text"": ""O Termo de Convênio de Estágio tem por objetivo garantir a oferta de campo de Estágio Curricular Obrigatório que proporcionem a elaboração e execução de ações conjuntas, que beneficiem estudantes e profissionais da universidade e adolescentes e profissionais do sistema socioeducativo"", ""labels"": [""objeto_convenio""]}, {""start"": 1775, ""end"": 1984, ""text"": ""Vigência de 60 meses, contados a partir da data da sua assinatura, e que após essa data caso haja interesse de ambos na sua continuidade, poderá ser providenciado um novo ajuste, observada a legislação vigente"", ""labels"": [""vigencia_convenio""]}, {""start"": 2006, ""end"": 2016, ""text"": ""15/12/2021"", ""labels"": [""data_assinatura_convenio""]}, {""start"": 858, ""end"": 901, ""text"": ""Secretaria de Estado de Justiça e Cidadania"", ""labels"": [""objeto_convenio""]}]",3,30242,2022-09-30T18:38:46.325696Z,2022-09-30T18:38:46.325720Z,
