text,pnum,x0,y0,x1,y1,y
"                                     Diário Oficial do Distrito Federal
PÁGINA   82
Nº 211, quinta-feira, 1° de novembro de 2001",0,28.319992065429688,31.09420394897461,736.9598999023438,52.483970642089844,False
"O GOVERNADOR  DO DISTRITO FEDERAL, no uso de suas atribuições que lhe confere o artigo
100, incisos XXVI e XXVII, da Lei Orgânica do Distrito Federal, e considerando o disposto no inciso
VIII do artigo 33, da Lei n.º 8.112, de 11 de dezembro de 1990, resolve:",0,28.32000732421875,146.72752380371094,368.6320495605469,178.2529754638672,False
"Retificar o ato que concedeu vacância do cargo de Auxiliar de Administração Pública, 3ª Classe,
Padrão II,  ocupado pelo servidor ALUÍSIO ABREU CIRINEU,  matrícula n.º 41.802-1,  publicado no
DODF n.º 237, de 09/12/1997, página 10.145, em virtude de posse em outro cargo inacumulável.",0,28.32000732421875,187.5275115966797,368.96026611328125,218.57298278808594,False
"ONDE SE LÊ: Vigência  a partir de 07/03/1997
LEIA-SE        : Vigência a partir de 10/03/1997",0,28.32000732421875,227.84751892089844,191.05712890625,248.81297302246094,False
"O GOVERNADOR DO DISTRITO FEDERAL, no uso das atribuições que lhe são conferidas pelo
artigo 100, incisos XXVI e XXVII da Lei Orgânica do Distrito Federal, e  e considerando o disposto
no artigo 4º, da Lei nº 1799 de 23 de dezembro de 1997, resolve:",0,28.32000732421875,258.0875244140625,368.6295471191406,289.13299560546875,False
"TORNAR SEM EFEITO o ato de nomeação da candidata, CLAUDIA MARIA CAETANO, nomeada
na vaga decorrente de aposentadoria de Maria Marlene Almeida Miranda, no  para o cargo de
Papiloscopista Policial, 2ª Classe, Padrão I, publicado no DODF 170 de 03/09/2001, pág. 62, por não
ter tomado posse em tempo hábil.",0,28.32000732421875,298.40753173828125,368.69451904296875,339.53302001953125,True
"O GOVERNADOR DO DISTRITO FEDERAL, no uso das atribuições que lhe confere o artigo 100,
incisos XXVI e XXVII, da Lei Orgânica do Distrito Federal, Resolve:",0,28.32000732421875,348.80755615234375,369.123046875,369.77301025390625,False
"Exonerar ADRIANI NÓBREGA GOMES, matrícula nº 104.660-8, do Cargo em Comissão, Símbolo
DFA-10,  de Assessor do Posto de Atendimento Regional de Taguatinga, do Instituto de Defesa do
Consumidor do Distrito Federal.",0,28.32000732421875,379.04754638671875,368.6169128417969,410.09295654296875,False
"Exonerar ANGELA MÁRCIA DE SOUZA PELES, matrícula nº 93.821-1, do Cargo em Comissão,
Símbolo DFG-02,  de Encarregada de Atendimento e Orientação, da Divisão de Informação e Divul-
gação, do Instituto de Defesa do Consumidor do Distrito Federal.",0,28.32000732421875,419.8475341796875,369.0696716308594,450.8929443359375,False
"Nomear ANGELA MÁRCIA DE SOUZA PELES, matrícula nº 93.821-1, para exercer o Cargo em
Comissão, Símbolo DFA-10,  de Assessor do Posto de Atendimento Regional de Taguatinga, do
Instituto de Defesa do Consumidor do Distrito Federal.",0,28.32000732421875,460.1675109863281,369.0613708496094,491.2129211425781,False
"Nomear ANA CRISTINA OLIVEIRA SANTOS, .para exercer o Cargo em Comissão, Símbolo DFG-
02,  de Encarregada de Atendimento e Orientação, da Divisão de Informação e Divulgação, do
Instituto de Defesa do Consumidor do Distrito Federal.",0,28.32000732421875,500.48748779296875,368.4209289550781,531.5328979492188,False
"O GOVERNADOR DO DISTRITO FEDERAL, no uso das atribuições que lhe confere o artigo 100,
incisos XXVI e XXVII, da Lei Orgânica do Distrito Federal, Resolve:",0,28.32000732421875,540.8074340820312,369.123046875,561.7728881835938,False
"Nomear ANDRÉ LUIZ ABRAHÃO,  para exercer o Cargo em Comissão, Símbolo DFG-10, de Chefe
do Núcleo de Divulgação, da Gerência de Divulgação, da Diretoria de Difusão Cultural, da Secretaria
de Estado de Cultura do Distrito Federal.",0,28.32000732421875,571.0474243164062,369.14398193359375,602.0928955078125,False
"O GOVERNADOR DO DISTRITO FEDERAL, no uso das atribuições que lhe confere o artigo 100,
incisos XXVI e XXVII, da Lei Orgânica do Distrito Federal, resolve:",0,28.32000732421875,611.367431640625,369.123046875,632.3328857421875,False
"TORNAR SEM EFEITO no Decreto de 18 de outubro de 2001, publicado no DODF nº 202, de 19 de
outubro de 2001, página 18, o ato que exonerou, a pedido, ALDEMIR PEREIRA CLEMENTINO,
matrícula nº 98.160-5, do Cargo em Comissão, Símbolo DFG-03, de Encarregado de Atendimento
Judiciário, da Unidade de Assistência Judiciária de Planaltina, do Centro de Assistência Judiciária do
Distrito Federal, do Gabinete do Governador, a contar de 20 de agosto de 2001.",0,28.32000732421875,641.1273803710938,368.57672119140625,690.8928833007812,False
"TORNAR SEM EFEITO no Decreto de 18 de outubro de 2001, publicado no DODF nº 202, de 19 de
outubro de 2001, página 18, o ato que exonerou, a pedido, VICTOR OLIVEIRA DRUMOND,
matrícula nº 94.289-8, do Cargo em Comissão, Símbolo DFG-03, de Encarregado de Atendimento
Judiciário, da Unidade de Assistência Judiciária de Brasília, do Centro de Assistência Judiciária do
Distrito Federal, do Gabinete do Governador, a contar de 10 de setembro de 2001.",0,28.32000732421875,699.6874389648438,368.8650207519531,749.932861328125,False
"TORNAR SEM EFEITO no Decreto de 18 de outubro de 2001, publicado no DODF nº 202, de 19 de
outubro de 2001, página 18, o ato que exonerou, por estar sendo nomeada para outro cargo, JULIA-
NA COUTINHO VIANA, matrícula nº 108.168-3, do Cargo em Comissão, Símbolo DFG-03, de
Encarregada de Atendimento Judiciário, da Unidade de Assistência Judiciária do Paranoá, do Centro de
Assistência Judiciária do Distrito Federal, do Gabinete do Governador.",0,28.32000732421875,758.7274780273438,368.1925048828125,808.492919921875,False
"TORNAR SEM EFEITO no Decreto de 18 de outubro de 2001, publicado no DODF nº 202, de 19 de
outubro de 2001, página 18, o ato que exonerou ELIENE JOSÉ FERREIRA, matrícula nº 94.270-7,
do Cargo em Comissão, Símbolo DFG-03, de Encarregado de Atendimento Judiciário,  do Diretor-
Geral, do Centro de Assistência Judiciária do Distrito Federal, do Gabinete do Governador, a contar de
19 de setembro de 2001.",0,28.32000732421875,817.2874755859375,369.0794372558594,867.5328979492188,False
"TORNAR SEM EFEITO no Decreto de 18 de outubro de 2001, publicado no DODF nº 202, de 19 de
outubro de 2001, página 18, o ato que nomeou EDSON GROSSI DE ANDRADE JÚNIOR, para
exercer o Cargo em Comissão, Símbolo DFG-03, de Encarregado de Atendimento Judiciário, do
Diretor-Geral do Centro de Assistência Judiciária do Distrito Federal, do Gabinete do Governador.",0,396.4800109863281,60.80742263793945,737.1159057617188,102.41289520263672,False
"TORNAR SEM EFEITO no Decreto de 18 de outubro de 2001, publicado no DODF nº 202, de 19 de
outubro de 2001, página 18, o ato que nomeou GLAYDSON PEREIRA DOS SANTOS, para exercer
o Cargo em Comissão, Símbolo DFG-03, de Encarregado de Atendimento Judiciário, da Unidade de
Assistência Judiciária de Planaltina, do Centro de Assistência Judiciária do Distrito Federal, do Gabi-
nete do Governador.",0,396.4800109863281,111.68742370605469,736.855224609375,162.89292907714844,False
"TORNAR SEM EFEITO no Decreto de 18 de outubro de 2001, publicado no DODF nº 202, de 19 de
outubro de 2001, página 18, o ato que nomeou JULIANA COUTINHO VIANA, matrícula nº 108.168-
3, para exercer o Cargo em Comissão, Símbolo DFG-03, de Encarregada de Atendimento Judiciário,
da Unidade de Assistência Judiciária de Brasília, do Centro de Assistência Judiciária do Distrito Federal,
do Gabinete do Governador.",0,396.4800109863281,172.16746520996094,737.2701416015625,223.3729705810547,False
"TORNAR SEM EFEITO no Decreto de 18 de outubro de 2001, publicado no DODF nº 202, de 19 de
outubro de 2001, página 18, o ato que nomeou GLAUCIENE MARCELINO MAGALHÃES, para
exercer o Cargo em Comissão, Símbolo DFG-03, de Encarregada de Atendimento Judiciário, da
Unidade de Assistência Judiciária do Paranoá, do Centro de Assistência Judiciária do Distrito Federal,
do Gabinete do Governador.",0,396.4800109863281,232.6475067138672,737.2705078125,283.85302734375,False
"TORNAR SEM EFEITO no Decreto de 18 de outubro de 2001, publicado no DODF nº 202, de 19 de
outubro de 2001, página 18, o ato que exonerou por estar sendo nomeada para outro cargo, EDSO-
NINA OLIVEIRA DE SOUZA, matrícula nº 104.427-3, do Cargo em Comissão, Símbolo DFG-03, de
Encarregada de Atendimento Judiciário, da Unidade de Assistência Judiciária de Ceilândia, do Centro
de Assistência Judiciária do Distrito Federal, do Gabinete do Governador.",0,396.4800109863281,293.1275634765625,736.8303833007812,344.81304931640625,False
"TORNAR SEM EFEITO no Decreto de 18 de outubro de 2001, publicado no DODF nº 202, de 19 de
outubro de 2001, página 18, o ato que exonerou por estar sendo nomeado para outro cargo, PAULO
HENRIQUE RIBEIRO CÔRTES, matrícula nº 108.107-1, do Cargo em Comissão, Símbolo DFG-03,
de Encarregado de Atendimento Judiciário, da Unidade de Assistência Judiciária de Taguatinga, do
Centro de Assistência Judiciária do Distrito Federal, do Gabinete do Governador.",0,396.4800109863281,354.08758544921875,737.2897338867188,405.2930603027344,False
"TORNAR SEM EFEITO no Decreto de 18 de outubro de 2001, publicado no DODF nº 202, de 19 de
outubro de 2001, página 18, o ato que nomeou EDSONINA OLIVEIRA DE SOUZA, matrícula nº
104.427-3,  para exercer o Cargo em Comissão, Símbolo DFG-03, de Encarregada de Atendimento
Judiciário, da Unidade de Assistência Judiciária de Taguatinga, do Centro de Assistência Judiciária do
Distrito Federal, do Gabinete do Governador.",0,396.4800109863281,414.567626953125,736.727783203125,465.77301025390625,False
"TORNAR SEM EFEITO no Decreto de 18 de outubro de 2001, publicado no DODF nº 202, de 19 de
outubro de 2001, página 18, o ato que nomeou PAULO HENRIQUE RIBEIRO CÔRTES, matrícula
nº 108.107-1, para exercer  o Cargo em Comissão, Símbolo DFG-03, de Encarregado de Atendimento
Judiciário, da Unidade de Assistência Judiciária de Ceilândia, do Centro de Assistência Judiciária do
Distrito Federal, do Gabinete do Governador.",0,396.4800109863281,475.0475769042969,737.27392578125,526.2529296875,False
"O GOVERNADOR DO DISTRITO FEDERAL no uso das atribuições que lhe confere o artigo 100,
inciso XXVII, da Lei Orgânica do Distrito Federal, e tendo em vista o que consta do Processo
Disciplinar nº 082.013.911/99, resolve:",0,396.4800109863281,535.5275268554688,737.2639770507812,566.5729370117188,False
"DEMITIR por abandono de emprego o Professor LUIZ ANTÔNIO GUEDES BASILE, matrícula nº
58.917-9, MG3V, por infrigência ao artigo 138, da Lei nº 8.112/90, face ao que dispõe o inciso II, do
artigo 132, da mesma Lei, aplicável ao Distrito Federal pela Lei Distrital nº 197/91.",0,396.4800109863281,576.3275146484375,736.3262329101562,607.3729248046875,False
"O GOVERNADOR DO DISTRITO FEDERAL, no uso das atribuições que lhe confere o artigo 100,
incisos XXVI e XXVII, da Lei Orgânica do Distrito Federal, resolve:",0,396.4800109863281,616.6475219726562,737.2824096679688,637.6129150390625,False
"Exonerar GILSOMAR SILVA BARBALHO, matrícula nº 46.364-7, do cargo em comissão de Assis-
tente, Símbolo DFG-05, Agência de Atendimento da Receita Sul da Gerência de Atendimento ao
Contribuinte da Subsecretaria da Receita da Secretaria de Fazenda e Planejamento do Distrito Federal,
por estar sendo nomeado para exercer outro cargo.",0,396.4800109863281,646.8875122070312,737.2791748046875,688.012939453125,False
"Nomear GILSOMAR SILVA BARBALHO, matrícula nº 46.364-7, para exercer o cargo em comissão
de Conselheiro Efetivo do Tribunal Administrativo de Recursos Fiscais da Secretaria de Fazenda e
Planejamento, Símbolo DFG-14, como representante do Distrito Federal, para mandato de três anos,
a partir de 13 (treze) de novembro de 2001.",0,396.4800109863281,697.2874755859375,737.2442626953125,738.4129638671875,False
"O GOVERNADOR DO DISTRITO FEDERAL, no uso das atribuições que lhe confere o artigo 100,
inciso XXVII, da Lei Orgânica do Distrito Federal, resolve:",0,396.4800109863281,747.6875,737.2824096679688,768.6529541015625,False
"Designar ISA MARIA GUIMARÃES ELIAS, matrícula nº 44.077-9, Diretora de Auditoria e Controle,
Símbolo DFG-14, para responder, cumulativa e interinamente, sem acumular vencimentos, pelo
cargo de natureza especial de Subsecretário de Auditoria, Símbolo CNE-06, da Secretaria de Fazenda
e Planejamento do Distrito Federal.",0,396.4800109863281,777.927490234375,737.3479614257812,819.052978515625,False
"O GOVERNADOR DO DISTRITO FEDERAL no uso das atribuições que lhe conferem os incisos
XXVI e XXVII, do artigo 100, da Lei Orgânica do Distrito Federal, resolve:
TORNAR SEM EFEITO o Decreto publicado no DODF nº 202, de 19 de outubro de 2001, página 20,
que nomeou CLÁUDIO FEREIRA DE MORAES, para exercer o Cargo em Comissão, de Chefe do",0,396.4800109863281,828.3275146484375,737.313232421875,868.012939453125,False
"                                                                      Diário Oficial do Distrito Federal
PÁGINA   83
Nº 211, quinta-feira, 1° de novembro de 2001",1,28.31999969482422,31.94562530517578,736.8765258789062,51.113468170166016,False
"Núcleo de Divulgação, Símbolo DFG10, da Gerência de Divulgação, da Diretoria de Difusão Cultural,
da Secretaria de Estado de Cultura do Distrito Federal.",1,28.31999969482422,61.28752517700195,369.1448669433594,82.25298309326172,False
"O Diretor-Presidente da Agência de Desenvolvimento do Turismo do Distrito Federal, no uso de suas
atribuições regimentais, constantes do artigo 33, inciso III, do Regimento aprovado pelo Decreto n
º 21.833, de 19.12.2000, resolve:",1,28.320037841796875,152.0074920654297,369.49627685546875,182.09288024902344,False
"Designar o servidor LUIZ RODRIGUES DOS SANTOS, matrícula nº 95.655-4, Assistente do Núcleo
de Apoio Material, Símbolo DFA-08, para substituir JOSÉ GONÇALVES RIBEIRO NETO, matrícula
nº 106.086-4, do cargo em comissão de Diretor de Apoio Operacional, da Agência de Desenvolvi-
mento do Turismo do Distrito Federal, por motivo do titular estar substituindo o Chefe de Gabinete,
no período de 01.11.2001  à  30.11.2001.",1,28.320037841796875,190.40745544433594,369.2030029296875,240.17283630371094,False
"O Diretor-Presidente da Agência de Desenvolvimento do Turismo do Distrito Federal, no uso de suas
atribuições regimentais, constantes do artigo 33, inciso III, do Regimento aprovado pelo Decreto n
º 21.833, de 19.12.2000, resolve:",1,28.320037841796875,287.847412109375,369.49627685546875,317.93280029296875,False
"Designar a servidora IVA MARIA DE JESUS, matrícula nº 95.990-1, do Cargo em Comissão de
Encarregado do Núcleo de Capacitação e Educação para o Turismo, Símbolo DFG-02, da Agência de
Desenvolvimento do Turismo do Distrito Federal,  para substituir LILIAN COUTO BEZERRA, do
cargo em comissão de Chefe do Núcleo de Criação Publicitária e Divulgação Turística, Símbolo DFG-
09, da Agência de Desenvolvimento do Turismo do Distrito Federal, por motivo de férias do titular,
no período de 06.11.2001 à 04.12.2001.",1,28.320037841796875,326.24737548828125,368.6224365234375,385.61273193359375,False
"ATOS DO VICE GOVERNADOR
Em 29 de outubro de  2001",1,141.1200408935547,459.207275390625,256.0459289550781,480.1726989746094,False
"O VICE-GOVERNADOR DO DISTRITO FEDERAL, no uso das atribuições regimentais e tendo em
vista a competência delegada pelo Artigo 1º, do Decreto n.º 13.917 de 22 de abril de 1992, resolve:",1,28.320037841796875,489.447265625,369.15960693359375,511.3727111816406,False
"EXONERAR,  o 1º SGT  QPPMC RUI XAVIER ROSA,  matrícula n.º 97.853-1 do cargo em
Comissão,  Símbolo DFG-11, de Chefe da Divisão de Pessoal do Gabinete do Vice-Goverandor do
Distrito Federal.",1,28.320037841796875,521.6072387695312,369.3320007324219,554.0927124023438,True
"NOMEAR, VALDECI PEREIRA DAMASCENO, matrícula n.º 30.472-7, para o Cargo em Comissão
Símbolo DFG-11 de Chefe da Divisão de Pessoal do Gabinete do Vice-Governador.",1,28.320037841796875,564.8073120117188,368.2148742675781,586.252685546875,False
"O VICE-GOVERNADOR DO DISTRITO FEDERAL, no uso das atribuições regimentais e tendo em
vista a competência delegada pelo Artigo 1º, do Decreto n.º 13.917 de 22 de abril de 1992, resolve:",1,28.320037841796875,615.6873168945312,369.15960693359375,636.1727294921875,False
"DESIGNAR  o servidor ELIAS TAVARES DA SILVA, matrícula  nº 93.378–3,  para substituir o Chefe
de Gabinete  do Vice-Governador, Símbolo CNE – 05,  no período de 01/11 a 15/11/2001,  por
motivo de Férias.",1,28.320037841796875,645.4473266601562,368.8005676269531,676.4927368164062,False
"DESPACHO DO CHEFE DE GABINETE
Em 29 de outubro de 2001",1,126.72004699707031,726.5673217773438,269.3721618652344,747.53271484375,False
"O CHEFE DE GABINETE DA VICE-GOVERNADORIA DO DISTRITO FEDERAL, no uso de suas
atribuições regimentais, resolve:",1,28.320045471191406,756.8073120117188,368.26654052734375,777.772705078125,False
"1- DESIGNAR os  servidores Roosevelt Costa Alves, Técnico Planejamento e Orçamento, matrícula
nº 30.883-1, Ronaldo Lúcio dos Reis, Auxiliar Militar, matrícula nº 97.929-5 e Cleusa Filomena
Ricardo, Analista de Desenvolvimento Agropecuário, matrícula nº 100406-9, para sob a presidência
do primeiro, comporem comissão para elaboração de Inventário Físico dos Bens Patrimoniais sob a
guarda do Gabinente do Vice-Governador, na forma do Dec. nº 16.109, de 01/12/94, no prazo de
60(sessenta) dias, a contar da data da publicação .",1,28.320045471191406,787.5272827148438,369.5306396484375,848.812744140625,True
"O DIRETOR DO DEPARTAMENTO DE ASSUNTOS ADMINISTRATIVOS DA SECRETARIA DE
GOVERNO, no uso das atribuições regimentais e considerando o disposto na Portaria n° 06 – SEG de
08 de junho de 1998, resolve:",1,396.96002197265625,134.24729919433594,737.4171142578125,165.2927703857422,False
"Designar os servidores abaixo relacionados como executores dos contratos que menciona:.
EDILSON CARRUSCA DE OLIVEIRA, matrícula n.º 46.294-2. Contrato n.º 055/2001– SEG, refe-
rente a serviços de locação de copiadora para SUCAR – Secretaria de Estado de Coordenação das
Administrações Regionais. Processo n.º: 010-000.860/2001. Contratada: TECNOLTA EQUIPA-
MENTOS ELETRÔNICOS LTDA.",1,396.96002197265625,175.04734802246094,737.26171875,226.7328338623047,True
"ADEMIR M. DE CARVALHO, matrícula n.º 01.511-3, Contrato n.º 037/2001 – SEG, referente a
aquisição de gás liquefeito de petróleo para a Pira do Panteão da Liberdade. Processo nº. 010.000.473/
2001. Contratada: MINASGÁS DISTRIBUIDORA DE GÁS COMBUSTÍVEL LTDA.",1,396.96002197265625,236.0073699951172,738.0989379882812,267.5328369140625,False
"DAVINO ALVES CAVALCANTE, Administrador da Residência Oficial de Águas Claras Contrato n.º
037/2001 – SEG, referente a aquisição de gás liquefeito de petróleo para a Residência Oficial de Águas
Claras. Processo nº. 010.000.473/2001. Contratada: MINASGÁS DISTRIBUIDORA DE GÁS COM-
BUSTÍVEL LTDA.",1,396.96002197265625,276.807373046875,737.280517578125,318.412841796875,False
"RAIMUNDO NONOTA MOTTA, matrícula n.º 93.914-5,Contrato n.º 035-A/2001 – SEG, referente
a locação de imóvel comercial, situado na QI 33 – Bloco A – Loja 22 – Ed. Senador Pedro Teixeira,
Guará II, para funcionamento do Posto do Procon do Guará/DF. Processo nº. 010.000.267/2001.
Contratada: LEILA CARDOSO CAMPOS LIMA. e do Contrato n.º 035-B/2001 – SEG, referente a
locação de imóvel comercial, situado na 3ª Avenida Comercial, n.º 1080-B, Núcleo Bandeirante, para
funcionamento do Posto do Procon do Núcleo Bandeirante/DF. Processo nº. 010.000.225/2001.
Contratada: ANTÔNIO CLÁUDIO GOMES FALCÃO.",1,396.96002197265625,328.16741943359375,738.2007446289062,400.0129089355469,False
"Cabendo-lhes  supervisionar, fiscalizar, acompanhar as execuções e atestar as faturas, de acordo com
as Normas de Execução Orçamentária, Financeira e Contábil do Distrito Federal.",1,396.96002197265625,409.7674560546875,737.75439453125,430.7328796386719,False
"OS SECRETÁRIOS DE ESTADO DE GESTÃO ADMINISTRATIVA E DE EDUCAÇÃO DO DIS-
TRITO FEDERAL, no uso das atribuições que lhes confere o art. 105, parágrafo único, inciso V, da
Lei Orgânica do Distrito Federal, resolvem:",1,396.9599914550781,525.4474487304688,737.347412109375,556.972900390625,False
"Art. 1º Instituir Comissão para tratar das atividades relativas à manutenção do cadastro e do paga-
mento, bem como a instrução dos processos de aposentadorias e pensões dos servidores inativos e
pensionistas da Secretaria de Estado de Educação, até a reorganização do Órgão Setorial de Recursos
Humanos para assumir tais encargos.",1,396.9599914550781,566.2474365234375,737.6455078125,607.8528442382812,False
"Raquel Cristina Barbosa Ferreira, matrícula n.º 44.728-5 – Presidente;
Lucy Arantes de Carvalho, matrícula n.º 68.408-2 – Membro;
Luciana de Oliveira Bravo, matrícula n.º 26.147-5 – Membro;
Lilian Beatriz de Bessa Fidelis,  matrícula n.º 39.056-9 – Membro;
Marli Esteves Fernandes Nunes, matrícula n.º 39.595-1 – Membro; e
Isabel Elena de Sousa Rabelo Marques, matrícula n.º 37.230-7 – Membro.",1,396.9599609375,637.7673950195312,697.2420654296875,699.5328369140625,False
"Art. 3º  Em caso de impedimento da presidente, assumirá a presidência a servidora Lucy Arantes de
Carvalho, matrícula n.º 68.408-2.",1,396.9599609375,709.2874145507812,736.7948608398438,730.2528076171875,False
"MARIA CECÍLIA S. S. LANDIM EURIDES BRITO DA SILVA
Secretária de Gestão Administrativa      Secretária de Educação",1,396.9599609375,760.1674194335938,722.6371459960938,781.1328125,False
"A SECRETÁRIA DE GESTÃO ADMINISTRATIVA DO DISTRITO FEDERAL, no uso de suas
atribuições legais e de acordo com o disposto no artigo 91, § 1º da Lei n.º 8.112, de 11 de dezembro
de 1990, combinado com artigo 5º § 1º, da Lei n.º 1.864, de 19 de janeiro de 1998,  resolve:",1,396.9599914550781,811.0474243164062,737.22705078125,842.5728759765625,False
"Autorizar a interrupção da licença para trato de interesse particular  e o consequente retorno às
atividades da servidora abaixo:",1,396.9599914550781,851.847412109375,736.5968017578125,872.8128662109375,False
"                                     Diário Oficial do Distrito Federal
PÁGINA   84
Nº 211, quinta-feira, 1° de novembro de 2001",2,28.319992065429688,31.09420394897461,736.9598999023438,52.483970642089844,False
"Ivanice Oliveira 
Velame, matrícula n.º 
91.050-3 ",2,32.15999984741211,72.11024475097656,102.13874053955078,100.90283966064453,False
"Técnico de Administração 
Pública, 3ª Classe, Padrão 
III. ",2,108.4800033569336,72.11024475097656,193.81851196289062,100.90283966064453,False
"A SECRETÁRIA DE GESTÃO ADMINISTRATIVA DO DISTRITO FEDERAL, no uso de suas
atribuições regimentais e tendo em vista o disposto no artigo 1º, do Decreto n.º 21.549, de 25 de
setembro de 2000, resolve:",2,28.319992065429688,166.40757751464844,368.5462341308594,196.4929656982422,False
" 
Nome: MAGDA TEREZA FRANCISCHETTI 
Matrícula: 14.394-4 
Cargo: Especialista em Educação 
Classe: Única 
Padrão: XXV 
Quadro: Q.P.D.F. 
Processo: 030.012749/94 
 ",2,31.67999267578125,232.09400939941406,189.9210662841797,316.6103210449219,False
" 
Artigo 186, inciso III, alínea “a”, e 189, 
parágrafo único, da Lei n.º 8.112, de 11 de 
dezembro de 1990, combinado com o artigo 41, 
inciso III, alínea “a”, e § 4º, da Lei Orgânica do 
Distrito Federal, e artigo 3º, da Emenda 
Constitucional n.º 20, de 16 de dezembro de 
1998, com as vantagens previstas no artigo 3º 
da Lei n.º 8.911, de 11 de julho de 1994, 
combinado com o artigo 7º da Lei n.º 1.004, de 
11 de janeiro de 1996, regulamentada pelo 
Decreto n.º 17.182, de 06 de março de 1996.  ",2,194.87998962402344,232.0939483642578,367.1021728515625,344.4502258300781,False
" 
Tornar sem efeito na Portaria n.º 169, de 15 de dezembro de 1994, publicada no Diário Oficial do
Distrito Federal, de 16 de dezembro de 1994, a parte que concedeu aposentadoria a MAGDA TEREZA
FRANCISCHETTI, matrícula n.º 14.394-4, do Quadro de Pessoal do Distrito Federal. Processo
030.012749/94.",2,28.31999969482422,343.1513671875,369.1431579589844,391.8529052734375,False
"O SUBSECRETÁRIO DE APOIO OPERACIONAL da Secretaria de Fazenda e Planejamento, no uso
de suas atribuições, previstas no Dec. nº 21.928, de 30/01/2001, publicado no DODF nº 122. de 31/
01/2001, art. 3º inciso III, concede:",2,28.320030212402344,514.8875122070312,368.7021179199219,544.972900390625,False
"Licença Paternidade aos servidores abaixo relacionados, nos termos do artigo 208, da Lei nº 8.112/
90, conforme certidões apresentadas:",2,28.320030212402344,553.2875366210938,368.57672119140625,573.77294921875,False
"NOME: RODRIGO TORRES PONTES 
MATRÍCULA: 44.154-6 
DEPENDENTE: MARIA JÚLIA MOURÃO 
PONTES 
PERÍODO: 05/08/2001 a 09/08/2001 
 ",2,31.20001792907715,577.8938598632812,177.20970153808594,634.6991577148438,False
"NOME: JAIR GUEDES CIRINEU 
MATRÍCULA: 43.359-4 
DEPENDENTE: MARIA LUIZA GUEDES 
PACHECO 
PERÍODO: 19/08/2001 a 23/08/2001 ",2,194.4000244140625,577.8938598632812,338.3699951171875,625.5791625976562,False
"O SUBSECRETÁRIO DE APOIO OPERACIONAL da Secretaria de Fazenda e Planejamento, no uso
de suas atribuições, previstas no Dec. nº 21.928, de 30/01/2001, publicado no DODF nº 122. de 31/
01/2001, art. 3º inciso III, concede:",2,28.31999969482422,680.0075073242188,368.7020568847656,709.1329345703125,False
