text,pnum,x0,y0,x1,y1,y
"Atos do Poder Legislativo 1 6
Atos do Poder Executivo 1 6
Vice-Governadoria
Casa Militar
Secretaria de Governo 1 7
Secretaria de Gestão Administrativa 7
Secretaria de Fazenda e Planejamento 2 8 14
Secretaria de Educação 9 15
Secretaria de Saúde 9
Secretaria de Ação Social 11
Secretaria de Infra-Estrutura e Obras 4 15
Secretaria de Agricultura, Pecuária e Abastecimento 4
Secretaria de Transportes
Secretaria de Segurança Pública 17
Corpo de Bombeiros Militar do Distrito Federal 17
Polícia Civil do Distrito Federal 12 17
Polícia Militar do Distrito Federal 12
Secretaria de Cultura 12 17
Secretaria de Desenvolvimento
Econômico, Ciência e Tecnologia 12
Secretaria de Comunicação Social
Secretaria de Meio Ambiente e Recursos Hidrícos 18
Secretaria de Desenvolvimento Urbano e Habitação
Secretaria de Articulação para o
Desenvolvimento do Entorno
Secretaria de Assuntos Fundiários 18
Secretaria de Esporte e Lazer 4
Secretaria de Trabalho e Direitos Humanos 19
Secretaria de Solidariedade
Secretaria de Coordenação das Administrações Regionais 5 13 19
Procuradoria Geral do Distrito Federal 20
Tribunal de Contas do Distrito Federal
Ineditoriais 20",0,34.079986572265625,247.5275115966797,351.1199951171875,642.4129638671875,False
"LEI Nº 2.802, DE 24 DE OUTUBRO DE 2001
(Autores do Projeto: Deputados Distritais Edimar Pireneus, José Tatico, Nijed Zakhour,
João de Deus e Aguinaldo de Jesus)",0,47.519996643066406,722.7275390625,348.8841247558594,757.6129760742188,False
"Orgânica do Distrito Federal, a seguinte Lei, oriunda de Projeto vetado pelo Governador do Distrito
Federal e mantido pela Câmara Legislativa do Distrito Federal:",0,28.319992065429688,807.20751953125,368.6114807128906,830.0929565429688,False
"Art. 1° Fica vedada a abertura do comércio aos domingos e feriados, no âmbito do Distrito Federal.
Parágrafo único. Excluem-se do disposto no caput o comércio de bares, restaurantes, drogarias ou",0,28.319992065429688,843.6875,368.996826171875,866.5729370117188,False
"Art. 2° O Governo do Distrito Federal designará, quando da sua regulamentação, os órgãos fiscaliza-
dores do disposto nesta Lei.",0,396.96002197265625,245.6074676513672,736.8129272460938,268.492919921875,False
"Brasília, 26   de outubro de 2001
Deputado GIM ARGELLO",0,511.20001220703125,329.60748291015625,622.9876098632812,352.492919921875,False
"O GOVERNADOR DO DISTRITO FEDERAL, no uso das atribuições que lhe confere o inciso VII do
art. 100 da Lei Orgânica do Distrito Federal, DECRETA:",0,396.9599914550781,470.72747802734375,736.8914794921875,493.6129150390625,False
"Art. 1º Fica prorrogado, excepcionalmente, para até o dia 31 do mes de outubro de 2001, o prazo de
que trata o art. 74 do Decreto nº 18.955, de 22 de dezembro de 1997, relativamente aos fatos geradores
ocorridos no mes de setembro de 2001, praticados pelas empresas fornecedoras de energia elétrica.",0,396.9599914550781,506.72747802734375,737.2850952148438,541.6129150390625,False
"Art. 2º Este decreto entra em vigor na data de sua publicação, surtindo efeitos a partir de 26 de
outubro de 2001.",0,396.9599914550781,554.7274780273438,736.6691284179688,577.6129150390625,False
"Brasília, 26 de outubro de 2001.
113º da República e 42º de Brasília
JOAQUIM DOMINGOS RORIZ",0,504.9599609375,614.7274780273438,629.4781494140625,650.1024780273438,False
"DESPACHO DO SECRETÁRIO
Em 22 de outubro de 2001",0,511.6799621582031,718.407470703125,622.1309204101562,740.8129272460938,False
"PROCESSO :  010.000.007/2001
INTERESSADO :  TELEBRASILIA CELULAR S.A
ASSUNTO :  SERVIÇO DE TELEFONIA CELULAR",0,396.9599609375,752.4874877929688,624.1666259765625,785.9329223632812,False
"Em cumprimento ao disposto no artigo 26, da Lei Federal n. º 8.666, de 21 de junho de 1993, RATIFICO
a inexigibilidade de licitação, com fulcro no caput do artigo 25, do citado Diploma Legal, conforme Nota
de Empenho n.º 01502/2001-SEG, emitida a favor de TELEBRASILIA CELULAR S.A, referente a
despesas com telefonia celular da Secretaria de Governo e órgãos vinculados, durante o corrente exercício.",0,396.9599609375,797.6074829101562,738.2186279296875,843.0529174804688,False
"                                     Diário Oficial do Distrito Federal
PÁGINA   2
Nº 208, segunda-feira, 29 de outubro de 2001",1,28.319992065429688,31.09420394897461,736.9033813476562,52.483970642089844,False
"WELIGTON LUIZ MORAES
Secretário de Comunicação Social",1,515.0400390625,807.1057739257812,653.6822509765625,832.67724609375,False
"LUIZ GONZAGA DE NEGREIROS
Diretor da Diretoria de Divulgação",1,514.0799560546875,836.3857421875,655.3890380859375,861.957275390625,False
"Redação e Administração:
Anexo do Palácio do Buriti, Sala 111, Térreo.
CEP: 70075-900, Brasília - DF
Telefones: (0XX61) 321-6736 – 223-6848 – 323-9012
Editoração e impressão: COMUNIDADE EDITORA",1,98.87994384765625,805.2764892578125,319.13800048828125,867.2372436523438,False
"Isenção do ICMS na importação de equipamentos didáticos, científicos e médico-hospitalares desti-
nados ao Programa de Modernização e Consolidação da Infra-estrutura Acadêmica das IFES e HUS.
O SUBSECRETÁRIO DA RECEITA DA SECRETARIA DE ESTADO DE FAZENDA E PLA-
NEJAMENTO DO DISTRITO FEDERAL, no uso da competência prevista no art. 70, do
Decreto nº 16.106, de 30.11.94, e fundamentado no item 95, subitens 95.1, 95.2 e 95.3 do
Caderno I do Anexo I do Regulamento do ICMS - Decreto nº 18.955 de 22/12/97 (Convênio
ICMS nº 123/97); verificado o cumprimento das exigências do artigo 14 da Lei Complemen-
tar nº 101, de 04 de maio de 2000 e, considerando ainda, o que consta do processo nº
040.004535/01, declara:",1,28.320018768310547,148.6475067138672,368.7544250488281,255.53294372558594,False
"Isenta do Imposto sobre Operações Relativas à Circulação de Mercadorias e sobre a Prestação de
Serviços de Transporte Interestadual e Intermunicipal e de Comunicação-ICMS a importação do
material, efetuada pela SECRETARIA DE EDUCAÇÃO SUPERIOR-SESu/ MINISTÉRIO DA EDU-
CAÇÃO – MEC, conforme tabela abaixo:",1,28.320018768310547,268.64752197265625,368.23211669921875,315.532958984375,False
"Fica o adquirente, desde já, NOTIFICADO a apresentar à Célula de Controle e Acompanha-
mento de Processos Especiais, da Gerência de Tributação, da Subsecretaria da Receita, da
Secretaria de Estado de Fazenda e Planejamento do Distrito Federal, a Declaração de Impor-
tação e o Comprovante de Importação, tão logo os obtenha, para cálculo da renúncia
efetiva, conforme o disposto no artigo 14 da Lei Complementar nº 101/2000 (Lei de Res-
ponsabilidade Fiscal).",1,396.47900390625,519.6879272460938,737.0853881835938,587.2133178710938,False
"Isenção do ICMS na importação de equipamentos didáticos, científicos e médico-hospitala-
res destinados ao Programa de Modernização e Consolidação da Infra-estrutura Acadêmica
das IFES e HUS.",1,396.47900390625,666.56787109375,737.3317260742188,700.0133056640625,False
"                                                                      Diário Oficial do Distrito Federal
PÁGINA   3
Nº 208, segunda-feira, 29 de outubro de 2001",2,28.31999969482422,31.94562530517578,736.0715942382812,51.113468170166016,False
"NEJAMENTO DO DISTRITO FEDERAL, no uso da competência prevista no art. 70, do
Decreto nº 16.106, de 30.11.94, e fundamentado no item 95, subitens 95.1, 95.2 e 95.3 do
Caderno I do Anexo I do Regulamento do ICMS - Decreto nº 18.955 de 22/12/97 (Convênio
ICMS nº 123/97); verificado o cumprimento das exigências do artigo 14 da Lei Complemen-
tar nº 101, de 04 de maio de 2000 e, considerando ainda, o que consta do processo nº
040.004536/01, declara:",2,28.31999969482422,62.7275276184082,368.75439453125,129.29295349121094,False
"Isenta do Imposto sobre Operações Relativas à Circulação de Mercadorias e sobre a Prestação de
Serviços de Transporte Interestadual e Intermunicipal e de Comunicação-ICMS a importação do
material, efetuada pela SECRETARIA DE EDUCAÇÃO SUPERIOR - SESu/ MINISTÉRIO DA EDU-
CAÇÃO – MEC, conforme tabela abaixo:",2,28.31999969482422,139.5275115966797,368.30059814453125,186.41294860839844,False
"Fica o adquirente, desde já, NOTIFICADO a apresentar à Célula de Controle e Acompanhamento de
Processos Especiais, da Gerência de Tributação, da Subsecretaria da Receita, da Secretaria de Estado
de Fazenda e Planejamento do Distrito Federal, a Declaração de Importação e o Comprovante de
Importação, tão logo os obtenha, para cálculo da renúncia efetiva, conforme o disposto no artigo 14
da Lei Complementar nº 101/2000 (Lei de Responsabilidade Fiscal).",2,28.319488525390625,532.6477661132812,368.6055908203125,581.9332275390625,False
"O GERENTE DE TRIBUTAÇÃO DA SUBSECRETARIA DA RECEITA DA SECRETARIA DE
ESTADO DE FAZENDA E PLANEJAMENTO DO DISTRITO FEDERAL, no uso das atribui-
ções previstas na Portaria n.º 104, artigo 111, inciso X, de 09.05.2000, e tendo em vista a
delegação de competência feita pela Ordem de Serviço n.º 088, art. 1º, alínea “b”, de 20 de
julho de 2000, e fundamentado no artigo 150, inciso VI, alínea “b” da Constituição Federal e
no inciso II do art. 11 do Decreto nº 16.100/94, e considerando ainda o que consta do processo
040.016296/97, declara:",2,28.319488525390625,688.6477661132812,369.63861083984375,756.6531982421875,False
"Não incidir o Imposto sobre a Propriedade Predial e Territorial Urbana - IPTU, a partir do exercício
de 1997, sobre o imóvel integrante do patrimônio da IGREJA DE CRISTO NO DISTRITO FEDE-
RAL e utilizado como templo, localizado no SHCG/N QD 703/704, BLOCO A, ÁREA ESPECIAL,
permanecendo o benefício enquanto mantidas as condições que o fundamentaram, lembrando que a
entidade fica obrigada a comunicar a esta Secretaria qualquer alteração que implique a cessação do
benefício, no prazo de 30 dias, a contar da data em que ocorrer a alteração (parágrafos 1º e 2º do artigo
11 do Decreto nº 16.100, de 29.11.94, modificado pelo Decreto nº 17.960/96);",2,28.319488525390625,764.9677734375,369.5299072265625,832.4932250976562,False
"O GERENTE DE TRIBUTAÇÃO DA SUBSECRETARIA DA RECEITA DA SECRETARIA DE
ESTADO DE FAZENDA E PLANEJAMENTO DO DISTRITO FEDERAL, no uso das atri-
buições previstas na Portaria nº 104, artigo 111, inciso X, de 09.05.2000, e tendo em vista
a delegação de competência feita pela Ordem de Serviço n.º 088, art. 1º, alínea “b”, de 20 de
julho de 2000, e ainda, fundamentado nos artigos 1º, 34 e 37 da Convenção de Viena sobre
Relações Diplomáticas, promulgada pelo Decreto n.º 56.435, de 08 de junho de 1965; veri-
ficado o cumprimento das exigências do artigo 14 da Lei Complementar nº 101, de 04 de
maio de 2000, e considerando ainda o que consta do processo nº 040.005187/2000, declara:",2,396.95947265625,110.72776794433594,737.8513793945312,205.6132049560547,False
"ROSARIO GUARINO, Funcionário Administrativo da Embaixada da Itália, isento do Impos-
to sobre a Propriedade de Veículos Automotores - IPVA, referente ao exercício 2001, na
proporção de 7/12 (sete doze avos), incidente sobre o veículo de sua propriedade, FIAT/
PALIO WEEKEND, ano de fabricação 1997, Placa JFB 8344.",2,396.95947265625,218.72776794433594,737.4532470703125,265.61322021484375,False
"O GERENTE DE TRIBUTAÇÃO DA SUBSECRETARIA DA RECEITA DA SECRETARIA DE
ESTADO DE FAZENDA E PLANEJAMENTO DO DISTRITO FEDERAL, no uso das atri-
buições previstas na Portaria nº 104, artigo 111, inciso X, de 09.05.2000, e tendo em vista
a delegação de competência feita pela Ordem de Serviço n.º 088, art. 1º, alínea “b”, de 20 de
julho de 2000, e ainda, fundamentado nos artigos 1º, 34 e 37 da Convenção de Viena sobre",2,396.95947265625,374.727783203125,737.8513793945312,433.61322021484375,False
"Relações Diplomáticas, promulgada pelo Decreto n.º 56.435, de 08 de junho de 1965; verifi-
cado o cumprimento das exigências do artigo 14 da Lei Complementar nº 101, de 04 de maio",2,396.95947265625,435.2077941894531,737.4255981445312,458.0932312011719,False
"GUGLIELMO CAUCHI, Funcionário Administrativo da Embaixada da Itália, isento do Im-
posto sobre a Propriedade de Veículos Automotores - IPVA, referente ao exercício 2001,
incidente sobre o veículo de sua propriedade, FIAT/ELBA 1.6 IE, ano de fabricação 1995,",2,396.95947265625,484.1678161621094,737.888916015625,519.05322265625,False
"Placa JEK 5530, lembrando que o benefício deverá ser renovado anualmente conforme o
disposto no § 2º do art. 6º do Decreto 16.099/94.",2,396.95947265625,520.6478271484375,737.7471313476562,543.5332641601562,False
"ESTADO DE FAZENDA E PLANEJAMENTO DO DISTRITO FEDERAL, no uso das atri-
buições previstas na Portaria nº 104, artigo 111, inciso X, de 09.05.2000, e tendo em vista",2,396.95947265625,667.0478515625,737.8513793945312,689.9332885742188,False
"a delegação de competência feita pela Ordem de Serviço nº 088, art. 1º, alínea “b”, de 20 de
julho de 2000, e considerando ainda o que consta do processo nº 040.001073/2000, declara:",2,396.95947265625,691.5278930664062,736.9296875,714.413330078125,False
"Revogado o Ato Declaratório nº 232/2000-CEESP/GETRI/SUREC/SEF, de 13 de abril de
2000, publicado no Diário Oficial do Distrito Federal nº 74, de 17.04.2000, pág. 08. A",2,396.95947265625,728.0078735351562,738.1453247070312,750.893310546875,False
"O GERENTE DE TRIBUTAÇÃO DA SUBSECRETARIA DA RECEITA DA SECRETARIA DE
ESTADO DE FAZENDA E PLANEJAMENTO DO DISTRITO FEDERAL, no uso das atribui-",2,396.95947265625,848.9678344726562,737.6997680664062,871.853271484375,False
"                                     Diário Oficial do Distrito Federal
PÁGINA   4
Nº 208, segunda-feira, 29 de outubro de 2001",3,28.319992065429688,31.09420394897461,736.9033813476562,52.483970642089844,False
"ções previstas na Portaria nº 104, artigo 111, inciso X, de 09.05.2000, e tendo em vista a
delegação de competência feita pela Ordem de Serviço nº 088, art. 1º, alínea “b”, de 20 de
julho de 2000, decide:",3,28.31999969482422,60.80754470825195,369.64019775390625,90.89293670654297,False
"Indeferir o pedido de isenção do IPTU/TLP referente ao exercício de 1999 para o imóvel
abaixo pertencente a aposentado/pensionista, tendo em vista o requerente não ser edificado,
contrariando o disposto no artigo 3º da Lei nº 1.362, de 30.12.96:",3,28.31999969482422,99.20750427246094,369.23046875,129.2928924560547,False
"    N.º PROC.                 INTERESSADO               IMÓVEL INSCR.
040001898/99 FRANCISCO FERNANDES DE MOURA
ST LESTE QD 10 LT 42 GAMA       7319315
Cabe ressaltar que o interessado tem o prazo de vinte dias para recorrer da presente decisão,
conforme o disposto no parágrafo 3º, inciso II, do art. 70 do Dec. nº 16.106/94.",3,28.31999969482422,137.6074676513672,369.2356262207031,188.81285095214844,False
"No ATO DECLARATÓRIO N.º 432/2000-CEESP/GETRI/SUREC/SEF, de 20 de julho de 2000, cujo
extrato foi publicado no Diário Oficial do Distrito Federal nº 153, de 10.08.2000, de reconhecimento
de isenção do IPVA, onde se lê: “O benefício concedido vigorará enquanto permanecerem as condi-
ções que o fundamentaram”, leia-se: “lembrando que a isenção deverá ser anualmente reconhecida,
conforme o disposto no § 2º do art. 6º do Decreto nº 16.099/94”.",3,28.32000732421875,240.8074188232422,368.68212890625,290.0927734375,False
"GERÊNCIA DE ATENDIMENTO AO CONTRIBUINTE
AGÊNCIA DE ATENDIMENTO DA RECEITA DO GAMA",3,75.3599853515625,299.2138671875,321.442626953125,323.3069152832031,False
"O CHEFE DA AGÊNCIA DE ATENDIMENTO DA RECEITA DO GAMA, no uso da competência
prevista no Art. 70 do Decreto 16.106, de 18/11/94 e no Art. 98, X, da PORTARIA 1.013, de 01/12/
94, alterada pela PORTARIA 104/00, que lhe foi delegada pelo item 3, alínea “b”, inciso VII, Art. 1º
da ORDEM DE SERVIÇO nº 88, de 20/07/00 e pela alínea “d”, item 1.1 da ORDEM DE SERVIÇO nº
128, de 16/10/00, e fundamentado na Lei nº 1.343, de 27/12/96, declara:",3,28.319965362548828,370.4073486328125,369.1651611328125,419.6927795410156,False
"Isento do Imposto sobre a Transmissão Causa Mortis e Doação de Quaisquer Bens ou Direitos –
ITCD, o beneficiário abaixo relacionado, em relação aos bens deixados  por falecimento da pessoa
especificada, conforme processo:",3,28.319965362548828,428.0073547363281,369.0424499511719,458.0928039550781,False
" PROCESSO Nº                    INTERESSADO        DE CUJOS      ÓBITO
044.01463/2001      Maria de Lourdes de Assis Souto Osvaldo Bras de Souto   24/06/2001",3,28.3199462890625,466.4073791503906,356.42169189453125,486.892822265625,False
"DESPACHO DO CHEFE
Em 26 de outubro de 2001(*)",3,147.3599395751953,533.607421875,249.5227813720703,554.5728759765625,False
"O CHEFE DA AGÊNCIA DE ATENDIMENTO DA RECEITA DO GAMA DA GERÊNCIA DE
ATENDIMENTO AO CONTRIBUINTE DA SUBSECRETARIA DA RECEITA DA SECRETARIA
DE ESTADO DE FAZENDA E PLANEJAMENTO  DO DISTRITO FEDERAL, no uso de suas
atribuições e tendo em vista a competência que lhe foi delegada pela Ordem de Serviço n.º 088-
SUREC de 20/07/2000, INDEFERE as COMPENSAÇÕES/RESTITUIÇÕES discriminadas abaixo,
por falta de amparo legal.",3,28.31993865966797,563.3673706054688,369.6225280761719,623.2128295898438,False
"    Processo nº. Interessado
124.001327/2000 Atila Zischegg
040.002094/2001 Carlos Saraiva Importação e Comércio Ltda",3,28.31993865966797,632.0073852539062,264.87506103515625,662.5728149414062,False
"Cumpre esclarecer que nos termos do § 2º, artigo 67 do Decreto nº16.106/1994 o Interessado poderá
recorrer da presente decisão no prazo de 20 (vinte) dias a contar da sua publicação.",3,28.31993865966797,670.8873901367188,369.0355224609375,691.8528442382812,False
"REGINALDO LIMA DE JESUS
____________
(*) Republicado por ter saído com incorreção do original, publicado no DODF n° 204 de 23/10/2001
página 10.",3,28.31993865966797,700.6473999023438,368.590087890625,740.8128662109375,False
"DESAPACHO DO SECRETÁRIO
Em 26 de outubro de 2001",3,140.15994262695312,803.367431640625,256.8316955566406,823.8528442382812,False
"PROCESSO Nº : 030-002.352/2001.
INTERESSADO: COMPANHIA URBANIZADORA DA NOVA CAPITAL DO BRASIL - NOVACAP.
ASSUNTO : DISPENSA DE LICITAÇÃO.
Em cumprimento ao disposto no Artigo 26, da Lei nº 8.666, de 21 de junho de 1993, e diante",3,28.31993865966797,832.1674194335938,368.77294921875,871.8528442382812,False
"das justificativas apresentadas no presente processo, ratifico a Dispensa de Licitação a favor
da COMPANHIA URBANIZADORA DA NOVA CAPITAL DO BRASIL – NOVACAP, CNPJ
00.037.457/0001-70, para atender despesas com o Contrato a ser firmado entre o Distrito
Federal, através da Secretaria de Infra-Estrutura e Obras e a NOVACAP, objetivando a
elaboração de projetos executivos: alteração de geometria viária entre o SAM, próximo ao
lote do DETRAN e o SGAN 907 a 911 e a criação de estacionamento; ampliação da EPIG no
trecho di SIG; acessos ao lote da Polícia Civil situado no SPO pela EPIG e pelo Parque da
Cidade; acesso ao SBS a partir da Via S-2 Leste e retificação da via interna ao Setor Cultural
Sul – SCTS, retornos na Avenida Recanto das Emas, duplicação da STRC/SIN/SAI, entre as
Via A1  e o trecho 1 da TRC 2. Fundamento legal da Dispensa de Licitação – Artigo 24, Inciso
VIII,  da  Lei nº 8.666/93.",3,396.4799499511719,60.80742263793945,737.68408203125,167.69261169433594,False
"SECRETARIA DE AGRICULTURA,
PECUÁRIA E ABASTECIMENTO",3,455.99993896484375,209.1162109375,677.1101684570312,242.61611938476562,False
"SOCIEDADE DE ABASTECIMENTO DE BRASÍLIA S/A – SAB
Em Liquidação",3,430.5599365234375,267.53369140625,702.8541259765625,289.61260986328125,False
"Processo nº 075-000.223/2000
Objeto: Despesas com ligações telefônicas.
Em cumprimento ao disposto no artigo 26 da Lei nº 8.666/93, republicada em 06.07.94,
RATIFICO a inexigibilidade de licitação, com fulcro no “Caput” do artigo 25 da referida Lei,
para a despesa relativa a ligações telefônicas, no mês de outubro do corrente exercício,
conforme à seguir:",3,396.4799499511719,318.087158203125,737.4727172851562,377.93255615234375,False
"                      EMPRESA VALOR (R$)
TELEBRASÍLIA BRASIL TELECOM S/A 1.076,61
TELEBRASÍLIA CELULAR S/A 884,53
EMBRATEL 23,05",3,396.47991943359375,386.72711181640625,634.6514282226562,426.8925476074219,False
"DESPACHOS DO SECRETÁRIO
Em 6 de setembro de 2001",3,509.75994873046875,512.9671020507812,624.0592651367188,535.8525390625,False
"PROCESSO:        0220.000.419/2001
INTERESSADO: FEDERAÇÃO METROPOLITANA DE KARATE-DO KOMU-DO E LUTAS AS-
SOCIADAS
ASSUNTO:          Inexigibilidade de Licitação",3,396.47991943359375,548.9671020507812,736.8563232421875,595.8525390625,False
"Ratifico, nos termos do Artigo 26,  da lei 8.666/93, a inexigibilidade de Licitação em favor do credor
acima citado, com o objetivo de atender despesas com transferência financeira para os campeonatos
Dancy de Karatê Protecto de Brasília.Para aquisição de Materiais e Pagamento de Arbitragem, de
Setembro à Dezembro/2001.SC 104/2001. A inexigibilidade foi fundamentada no que dispõe o Caput
do Artigo 25, da Lei 8.666 de 21 de junho de 1993, tendo em vista o constante do processo acima
citado. Publique-se.",3,396.47991943359375,608.9671020507812,736.767578125,679.8525390625,False
"PROCESSO:        0220.000.624/2001
INTERESSADO: COMPANHIA DO DESENVOLVIMENTO DO PLANALTO CENTRAL-CODEPLAN
ASSUNTO:          Inexigibilidade de Licitação",3,396.47991943359375,716.9671020507812,736.5718383789062,751.8525390625,False
"Ratifico, nos termos do Artigo 26,  da lei 8.666/93, a inexigibilidade de Licitação em favor do credor
acima citado, com o objetivo de atender despesas com locação de equipamentos(computadores
completos) para esta Secretaria no exercício de 2001. A inexigibilidade foi fundamentada no que
dispõe o Caput do Artigo 25, da Lei 8.666 de 21 de junho de 1993, tendo em vista o constante do
processo acima citado. Publique-se.",3,396.47991943359375,764.9671020507812,736.767578125,823.8525390625,False
"PROCESSO: 0220.000.454/2001
INTERESSADO: FEDERAÇÃO BRASILIENSE DE VOLIBOL
ASSUNTO: Inexigibilidade de Licitação",3,396.47991943359375,836.9671020507812,612.523681640625,871.8525390625,False
"                                                                      Diário Oficial do Distrito Federal
PÁGINA   5
Nº 208, segunda-feira, 29 de outubro de 2001",4,28.31999969482422,31.94562530517578,736.0715942382812,51.113468170166016,False
"Ratifico, nos termos do Artigo 26,  da lei 8.666/93, a inexigibilidade de Licitação em favor do credor
acima citado, com o objetivo de atender despesa com transferência financeira para o campeonato
brasileiro seleção juvenil no estado de Alagoas no período de 21 a 28 de outubro de 2001. A inexigi-
bilidade foi fundamentada no que dispõe o Caput do Artigo 25, da Lei 8.666 de 21 de junho de 1993,
tendo em vista o constante do processo acima citado. Publique-se.",4,28.31999969482422,62.7275276184082,369.1150207519531,121.61296844482422,False
"PROCESSO:        0220.000.342/2001
INTERESSADO: FEDERAÇÃO METROPOLITANA DE JUDÔ
ASSUNTO:          Inexigibilidade de Licitação",4,28.31999969482422,149.60752868652344,250.04931640625,179.6929168701172,False
"Ratifico, nos termos do Artigo 26,  da lei 8.666/93, a inexigibilidade de Licitação em favor do credor
acima citado, com o objetivo de atender despesas com transferência de recursos para o programa de
judô comuniário. A inexigibilidade foi fundamentada no que dispõe o Caput do Artigo 25, da Lei 8.666
de 21 de junho de 1993, tendo em vista o constante do processo acima citado. Publique-se.",4,28.31999969482422,188.0074920654297,368.6679382324219,227.69285583496094,False
"PROCESSO:        0220.000.264/2001
INTERESSADO: FEDERAÇÃO BRASILIENSE DE TIRO
ASSUNTO:          Inexigibilidade de Licitação",4,28.31999969482422,236.00743103027344,228.5174102783203,266.09283447265625,False
"Ratifico, nos termos do Artigo 26,  da lei 8.666/93, a inexigibilidade de Licitação em favor do credor
acima citado, com o objetivo de atender despesas com transferência de recursos para o Campeonato
Centro Brasileiro de Tiro, modalidade Pratos e Balas. A inexigibilidade foi fundamentada no que
dispõe o Caput do Artigo 25, da Lei 8.666 de 21 de junho de 1993, tendo em vista o constante do
processo acima citado. Publique-se.",4,28.31999969482422,274.40740966796875,368.60736083984375,323.6927490234375,False
"PROCESSO:        0220.000.282/2001
INTERESSADO: FEDERAÇÃO BRASILIENSE DE ATLETISMO
ASSUNTO:          Inexigibilidade de Licitação",4,28.31999969482422,332.00732421875,255.85467529296875,362.09271240234375,False
"Ratifico, nos termos do Artigo 26,  da lei 8.666/93, a inexigibilidade de Licitação em favor do credor
acima citado, com o objetivo de atender despesas com transferência de recursos para a 11ª corrida do
fogo, corrida mirim e de pessoas portadoras de necessidades  especiais sc 136. A inexigibilidade foi
fundamentada no que dispõe o Caput do Artigo 25, da Lei 8.666 de 21 de junho de 1993, tendo em
vista o constante do processo acima citado. Publique-se.",4,28.31999969482422,370.40728759765625,369.09033203125,419.6927185058594,False
"PROCESSO:        0220.000393/2001
INTERESSADO: LIGA REGIONAL DE DESPORTOS DO PLANALTO
ASSUNTO:          Inexigibilidade de Licitação",4,28.31999969482422,428.0072937011719,275.5897216796875,458.0927429199219,False
